id_work	score_work	info_title_work	info_pages_work	info_year_work	info_type_work	info_key_work	info_url_work	info_doi_work	info_ee_work	url_work
274847	1	From a Conceptual Model to a Knowledge Graph for Genomic Datasets.	352-360	2019	Conference and Workshop Papers	conf/er/0002CC19	https://dblp.org/rec/conf/er/0002CC19	10.1007/978-3-030-33223-5_29	https://doi.org/10.1007/978-3-030-33223-5_29	URL#274847
274849	1	OOC-O - A Reference Ontology on Object-Oriented Code.	13-27	2019	Conference and Workshop Papers	conf/er/AguiarFS19	https://dblp.org/rec/conf/er/AguiarFS19	10.1007/978-3-030-33223-5_3	https://doi.org/10.1007/978-3-030-33223-5_3	URL#274849
274850	1	An Ontological Perspective for Database Tuning Heuristics.	240-254	2019	Conference and Workshop Papers	conf/er/AlmeidaCBLOS19	https://dblp.org/rec/conf/er/AlmeidaCBLOS19	10.1007/978-3-030-33223-5_20	https://doi.org/10.1007/978-3-030-33223-5_20	URL#274850
274851	1	Events as Entities in Ontology-Driven Conceptual Modeling.	469-483	2019	Conference and Workshop Papers	conf/er/AlmeidaFG19	https://dblp.org/rec/conf/er/AlmeidaFG19	10.1007/978-3-030-33223-5_39	https://doi.org/10.1007/978-3-030-33223-5_39	URL#274851
274852	1	Capturing Multi-level Models in a Two-Level Formal Modeling Technique.	43-51	2019	Conference and Workshop Papers	conf/er/AlmeidaMCFG19	https://dblp.org/rec/conf/er/AlmeidaMCFG19	10.1007/978-3-030-33223-5_5	https://doi.org/10.1007/978-3-030-33223-5_5	URL#274852
274853	1	Exploring the Modeling of Declarative Processes Using a Hybrid Approach.	162-170	2019	Conference and Workshop Papers	conf/er/AndaloussiBLSW19	https://dblp.org/rec/conf/er/AndaloussiBLSW19	10.1007/978-3-030-33223-5_14	https://doi.org/10.1007/978-3-030-33223-5_14	URL#274853
274857	1	A Probabilistic Approach to Event-Case Correlation for Process Mining.	136-152	2019	Conference and Workshop Papers	conf/er/BayomieCRM19	https://dblp.org/rec/conf/er/BayomieCRM19	10.1007/978-3-030-33223-5_12	https://doi.org/10.1007/978-3-030-33223-5_12	URL#274857
274862	1	Schema Validation and Evolution for Graph Databases.	448-456	2019	Conference and Workshop Papers	conf/er/BonifatiFGHOV19	https://dblp.org/rec/conf/er/BonifatiFGHOV19	10.1007/978-3-030-33223-5_37	https://doi.org/10.1007/978-3-030-33223-5_37	URL#274862
274863	1	Intuitive Understanding of Domain-Specific Modeling Languages - Proposition and Application of an Evaluation Technique.	311-319	2019	Conference and Workshop Papers	conf/er/BorkSK19	https://dblp.org/rec/conf/er/BorkSK19	10.1007/978-3-030-33223-5_26	https://doi.org/10.1007/978-3-030-33223-5_26	URL#274863
274864	1	DEMOS - A Participatory Design Approach for Democratic Empowerment of IS Users.	387-394	2019	Conference and Workshop Papers	conf/er/BourSV19	https://dblp.org/rec/conf/er/BourSV19	10.1007/978-3-030-33223-5_32	https://doi.org/10.1007/978-3-030-33223-5_32	URL#274864
274866	1	A Systematic Approach to Generate Diverse Instantiations for Conceptual Schemas.	513-521	2019	Conference and Workshop Papers	conf/er/BurguenoCCG19	https://dblp.org/rec/conf/er/BurguenoCCG19	10.1007/978-3-030-33223-5_42	https://doi.org/10.1007/978-3-030-33223-5_42	URL#274866
274870	1	Finding Preferred Objects with Taxonomies.	397-411	2019	Conference and Workshop Papers	conf/er/CiacciaMT19	https://dblp.org/rec/conf/er/CiacciaMT19	10.1007/978-3-030-33223-5_33	https://doi.org/10.1007/978-3-030-33223-5_33	URL#274870
274871	1	On the Use of Requirement Patterns to Analyse Request for Proposal Documents.	549-557	2019	Conference and Workshop Papers	conf/er/CostalFLPQ19	https://dblp.org/rec/conf/er/CostalFLPQ19	10.1007/978-3-030-33223-5_45	https://doi.org/10.1007/978-3-030-33223-5_45	URL#274871
274877	1	Don't Tune Twice - Reusing Tuning Setups for SQL-on-Hadoop Queries.	93-107	2019	Conference and Workshop Papers	conf/er/FilhoAS19a	https://dblp.org/rec/conf/er/FilhoAS19a	10.1007/978-3-030-33223-5_9	https://doi.org/10.1007/978-3-030-33223-5_9	URL#274877
274878	1	iStar-p - A Modelling Language for Requirements Prioritization.	540-548	2019	Conference and Workshop Papers	conf/er/FlorioLP019	https://dblp.org/rec/conf/er/FlorioLP019	10.1007/978-3-030-33223-5_44	https://doi.org/10.1007/978-3-030-33223-5_44	URL#274878
274879	1	Relations in Ontology-Driven Conceptual Modeling.	28-42	2019	Conference and Workshop Papers	conf/er/FonsecaPGAG19	https://dblp.org/rec/conf/er/FonsecaPGAG19	10.1007/978-3-030-33223-5_4	https://doi.org/10.1007/978-3-030-33223-5_4	URL#274879
274881	1	Negation in Relational Keyword Search.	173-188	2019	Conference and Workshop Papers	conf/er/GaoLL19	https://dblp.org/rec/conf/er/GaoLL19	10.1007/978-3-030-33223-5_15	https://doi.org/10.1007/978-3-030-33223-5_15	URL#274881
274882	1	What Rocks Are Made of - Towards an Ontological Pattern for Material Constitution in the Geological Domain.	275-286	2019	Conference and Workshop Papers	conf/er/GarciaCRAA19	https://dblp.org/rec/conf/er/GarciaCRAA19	10.1007/978-3-030-33223-5_23	https://doi.org/10.1007/978-3-030-33223-5_23	URL#274882
274883	1	Modeling Data Lakes with Data Vault - Practical Experiences, Assessment, and Lessons Learned.	63-77	2019	Conference and Workshop Papers	conf/er/GieblerGHSM19	https://dblp.org/rec/conf/er/GieblerGHSM19	10.1007/978-3-030-33223-5_7	https://doi.org/10.1007/978-3-030-33223-5_7	URL#274883
274884	1	iStar4RationalAgents - Modeling Requirements of Multi-agent Systems with Rational Agents.	558-566	2019	Conference and Workshop Papers	conf/er/Goncalves0C19	https://dblp.org/rec/conf/er/Goncalves0C19	10.1007/978-3-030-33223-5_46	https://doi.org/10.1007/978-3-030-33223-5_46	URL#274884
274885	1	HIKE - A Step Beyond Data Exchange.	423-438	2019	Conference and Workshop Papers	conf/er/GrecoMST19	https://dblp.org/rec/conf/er/GrecoMST19	10.1007/978-3-030-33223-5_35	https://doi.org/10.1007/978-3-030-33223-5_35	URL#274885
274886	1	A Reference Conceptual Model for Virtual Network Function Online Marketplaces.	302-310	2019	Conference and Workshop Papers	conf/er/GuizzardiBGSS19	https://dblp.org/rec/conf/er/GuizzardiBGSS19	10.1007/978-3-030-33223-5_25	https://doi.org/10.1007/978-3-030-33223-5_25	URL#274886
274888	1	Relaxed Functional Dependency Discovery in Heterogeneous Data Lakes.	225-239	2019	Conference and Workshop Papers	conf/er/HaiQW19	https://dblp.org/rec/conf/er/HaiQW19	10.1007/978-3-030-33223-5_19	https://doi.org/10.1007/978-3-030-33223-5_19	URL#274888
274889	1	Answering GPSJ Queries in a Polystore - A Dataspace-Based Approach.	189-203	2019	Conference and Workshop Papers	conf/er/HamadouGG19	https://dblp.org/rec/conf/er/HamadouGG19	10.1007/978-3-030-33223-5_16	https://doi.org/10.1007/978-3-030-33223-5_16	URL#274889
274891	1	Unified Management of Multi-model Data - (Vision Paper).	439-447	2019	Conference and Workshop Papers	conf/er/HolubovaSL19	https://dblp.org/rec/conf/er/HolubovaSL19	10.1007/978-3-030-33223-5_36	https://doi.org/10.1007/978-3-030-33223-5_36	URL#274891
274894	1	Conceptualization, Design, and Implementation of EconBPC - A Software Artifact for the Economic Analysis of Business Process Compliance.	378-386	2019	Conference and Workshop Papers	conf/er/KuhnelTL19	https://dblp.org/rec/conf/er/KuhnelTL19	10.1007/978-3-030-33223-5_31	https://doi.org/10.1007/978-3-030-33223-5_31	URL#274894
274895	1	A Unifying Model of Legal Smart Contracts.	323-337	2019	Conference and Workshop Papers	conf/er/LadleifW19	https://dblp.org/rec/conf/er/LadleifW19	10.1007/978-3-030-33223-5_27	https://doi.org/10.1007/978-3-030-33223-5_27	URL#274895
274899	1	Requirements-Driven Visualizations for Big Data Analytics - A Model-Driven Approach.	78-92	2019	Conference and Workshop Papers	conf/er/LavalleMT19	https://dblp.org/rec/conf/er/LavalleMT19	10.1007/978-3-030-33223-5_8	https://doi.org/10.1007/978-3-030-33223-5_8	URL#274899
274900	1	Learning k-Occurrence Regular Expressions from Positive and Negative Samples.	264-272	2019	Conference and Workshop Papers	conf/er/LiMC19	https://dblp.org/rec/conf/er/LiMC19	10.1007/978-3-030-33223-5_22	https://doi.org/10.1007/978-3-030-33223-5_22	URL#274900
274901	1	Role-Based Clustering for Collaborative Recommendations in Crowdsourcing System.	287-301	2019	Conference and Workshop Papers	conf/er/LiaoZWF019	https://dblp.org/rec/conf/er/LiaoZWF019	10.1007/978-3-030-33223-5_24	https://doi.org/10.1007/978-3-030-33223-5_24	URL#274901
274902	1	Factors Affecting Comprehension of Contribution Links in Goal Models - An Experiment.	525-539	2019	Conference and Workshop Papers	conf/er/LiaskosT19	https://dblp.org/rec/conf/er/LiaskosT19	10.1007/978-3-030-33223-5_43	https://doi.org/10.1007/978-3-030-33223-5_43	URL#274902
274908	1	Modal Schema Graphs for Graph Databases.	498-512	2019	Conference and Workshop Papers	conf/er/Mennicke19	https://dblp.org/rec/conf/er/Mennicke19	10.1007/978-3-030-33223-5_41	https://doi.org/10.1007/978-3-030-33223-5_41	URL#274908
274909	1	Query Rewriting for Continuously Evolving NoSQL Databases.	213-221	2019	Conference and Workshop Papers	conf/er/MollerKHS19	https://dblp.org/rec/conf/er/MollerKHS19	10.1007/978-3-030-33223-5_18	https://doi.org/10.1007/978-3-030-33223-5_18	URL#274909
274911	1	An SQL o Front-End for Non-monotonic Inheritance and De-referencing.	52-60	2019	Conference and Workshop Papers	conf/er/Oduro-AfriyieJ19	https://dblp.org/rec/conf/er/Oduro-AfriyieJ19	10.1007/978-3-030-33223-5_6	https://doi.org/10.1007/978-3-030-33223-5_6	URL#274911
274914	1	Grounding for an Enterprise Computing Nomenclature Ontology.	457-465	2019	Conference and Workshop Papers	conf/er/PartridgeMC19	https://dblp.org/rec/conf/er/PartridgeMC19	10.1007/978-3-030-33223-5_38	https://doi.org/10.1007/978-3-030-33223-5_38	URL#274914
274915	1	Formal Specification of Environmental Aspects of a Railway Interlocking System Based on a Conceptual Model.	338-351	2019	Conference and Workshop Papers	conf/er/PereiraDPBD19	https://dblp.org/rec/conf/er/PereiraDPBD19	10.1007/978-3-030-33223-5_28	https://doi.org/10.1007/978-3-030-33223-5_28	URL#274915
274917	1	Ontology-Schema Based Query by Example.	204-212	2019	Conference and Workshop Papers	conf/er/PeresSMA19a	https://dblp.org/rec/conf/er/PeresSMA19a	10.1007/978-3-030-33223-5_17	https://doi.org/10.1007/978-3-030-33223-5_17	URL#274917
274922	1	SkipSJoin - A New Physical Design for Distributed Big Data Warehouses in Hadoop.	255-263	2019	Conference and Workshop Papers	conf/er/RamdaneKBB19	https://dblp.org/rec/conf/er/RamdaneKBB19	10.1007/978-3-030-33223-5_21	https://doi.org/10.1007/978-3-030-33223-5_21	URL#274922
274923	1	Decision-Making in Knowledge-intensive Processes - The Case of Value Ascription and Goal Processing.	363-377	2019	Conference and Workshop Papers	conf/er/RichettiBC19	https://dblp.org/rec/conf/er/RichettiBC19	10.1007/978-3-030-33223-5_30	https://doi.org/10.1007/978-3-030-33223-5_30	URL#274923
274925	1	DCR-KiPN a Hybrid Modeling Approach for Knowledge-Intensive Processes.	153-161	2019	Conference and Workshop Papers	conf/er/SantoroSHB19	https://dblp.org/rec/conf/er/SantoroSHB19	10.1007/978-3-030-33223-5_13	https://doi.org/10.1007/978-3-030-33223-5_13	URL#274925
274927	1	A Graph Model for Taxi Ride Sharing Supported by Graph Databases.	108-116	2019	Conference and Workshop Papers	conf/er/SteinmetzM0H19	https://dblp.org/rec/conf/er/SteinmetzM0H19	10.1007/978-3-030-33223-5_10	https://doi.org/10.1007/978-3-030-33223-5_10	URL#274927
274928	1	Generic Negative Scenarios for the Specification of Collaborative Cyber-Physical Systems.	412-419	2019	Conference and Workshop Papers	conf/er/StenkovaBDW19	https://dblp.org/rec/conf/er/StenkovaBDW19	10.1007/978-3-030-33223-5_34	https://doi.org/10.1007/978-3-030-33223-5_34	URL#274928
274931	1	Parallel Clique-Like Subgraph Counting and Listing.	484-497	2019	Conference and Workshop Papers	conf/er/YangYZG19	https://dblp.org/rec/conf/er/YangYZG19	10.1007/978-3-030-33223-5_40	https://doi.org/10.1007/978-3-030-33223-5_40	URL#274931
274933	1	Comprehensive Process Drift Detection with Visual Analytics.	119-135	2019	Conference and Workshop Papers	conf/er/YeshchenkoCMP19a	https://dblp.org/rec/conf/er/YeshchenkoCMP19a	10.1007/978-3-030-33223-5_11	https://doi.org/10.1007/978-3-030-33223-5_11	URL#274933
640440	1	How the Conceptual Modelling Improves the Security on Document Databases.	497-504	2018	Conference and Workshop Papers	conf/er/BlancoGPMOF18	https://dblp.org/rec/conf/er/BlancoGPMOF18	10.1007/978-3-030-00847-5_36	https://doi.org/10.1007/978-3-030-00847-5_36	URL#640440
640444	1	Modeling Conceptual Characteristics of Virtual Machines for CPU Utilization Prediction.	319-333	2018	Conference and Workshop Papers	conf/er/ChenSZ18	https://dblp.org/rec/conf/er/ChenSZ18	10.1007/978-3-030-00847-5_23	https://doi.org/10.1007/978-3-030-00847-5_23	URL#640444
640445	1	Conceptual Modeling of Processes and Data - Connecting Different Perspectives.	236-250	2018	Conference and Workshop Papers	conf/er/CombiOWZ18	https://dblp.org/rec/conf/er/CombiOWZ18	10.1007/978-3-030-00847-5_18	https://doi.org/10.1007/978-3-030-00847-5_18	URL#640445
640447	1	Towards Conceptual Models for Machine Learning Computations.	44077	2018	Conference and Workshop Papers	conf/er/DamianiF18	https://dblp.org/rec/conf/er/DamianiF18	10.1007/978-3-030-00847-5_1	https://doi.org/10.1007/978-3-030-00847-5_1	URL#640447
640450	1	A Reference Framework for Conceptual Modeling.	27-42	2018	Conference and Workshop Papers	conf/er/DelcambreLPS18	https://dblp.org/rec/conf/er/DelcambreLPS18	10.1007/978-3-030-00847-5_4	https://doi.org/10.1007/978-3-030-00847-5_4	URL#640450
640453	1	Interactive Data-Driven Process Model Construction.	251-265	2018	Conference and Workshop Papers	conf/er/DixitVBA18	https://dblp.org/rec/conf/er/DixitVBA18	10.1007/978-3-030-00847-5_19	https://doi.org/10.1007/978-3-030-00847-5_19	URL#640453
640455	1	Towards an Ontology of Software Defects, Errors and Failures.	349-362	2018	Conference and Workshop Papers	conf/er/DuarteFGGS18	https://dblp.org/rec/conf/er/DuarteFGGS18	10.1007/978-3-030-00847-5_25	https://doi.org/10.1007/978-3-030-00847-5_25	URL#640455
640458	1	Multi-level Conceptual Modeling - From a Formal Theory to a Well-Founded Language.	409-423	2018	Conference and Workshop Papers	conf/er/FonsecaAGC18	https://dblp.org/rec/conf/er/FonsecaAGC18	10.1007/978-3-030-00847-5_29	https://doi.org/10.1007/978-3-030-00847-5_29	URL#640458
640459	1	A Semantic Framework for Designing Temporal SQL Databases.	382-396	2018	Conference and Workshop Papers	conf/er/GaoLDZ18	https://dblp.org/rec/conf/er/GaoLDZ18	10.1007/978-3-030-00847-5_27	https://doi.org/10.1007/978-3-030-00847-5_27	URL#640459
640461	1	TemporalEMF - A Temporal Metamodeling Framework.	365-381	2018	Conference and Workshop Papers	conf/er/GomezCW18	https://dblp.org/rec/conf/er/GomezCW18	10.1007/978-3-030-00847-5_26	https://doi.org/10.1007/978-3-030-00847-5_26	URL#640461
640462	1	Towards Quality Analysis for Document Oriented Bases.	200-216	2018	Conference and Workshop Papers	conf/er/GomezRC18	https://dblp.org/rec/conf/er/GomezRC18	10.1007/978-3-030-00847-5_16	https://doi.org/10.1007/978-3-030-00847-5_16	URL#640462
640463	1	Conceptual Modeling of Legal Relations.	169-183	2018	Conference and Workshop Papers	conf/er/GriffoAG18	https://dblp.org/rec/conf/er/GriffoAG18	10.1007/978-3-030-00847-5_14	https://doi.org/10.1007/978-3-030-00847-5_14	URL#640463
640464	1	Reification and Truthmaking Patterns.	151-165	2018	Conference and Workshop Papers	conf/er/GuarinoSG18	https://dblp.org/rec/conf/er/GuarinoSG18	10.1007/978-3-030-00847-5_13	https://doi.org/10.1007/978-3-030-00847-5_13	URL#640464
640465	1	Endurant Types in Ontology-Driven Conceptual Modeling - Towards OntoUML 2.0.	136-150	2018	Conference and Workshop Papers	conf/er/GuizzardiFBAPS18	https://dblp.org/rec/conf/er/GuizzardiFBAPS18	10.1007/978-3-030-00847-5_12	https://doi.org/10.1007/978-3-030-00847-5_12	URL#640465
640467	1	CRAN - A Hybrid CNN-RNN Attention-Based Model for Text Classification.	571-585	2018	Conference and Workshop Papers	conf/er/GuoZWWC18	https://dblp.org/rec/conf/er/GuoZWWC18	10.1007/978-3-030-00847-5_42	https://doi.org/10.1007/978-3-030-00847-5_42	URL#640467
640468	1	Nested Schema Mappings for Integrating JSON.	397-405	2018	Conference and Workshop Papers	conf/er/HaiQK18	https://dblp.org/rec/conf/er/HaiQK18	10.1007/978-3-030-00847-5_28	https://doi.org/10.1007/978-3-030-00847-5_28	URL#640468
640469	1	Modeling Strategies for Storing Data in Distributed Heterogeneous NoSQL Databases.	488-496	2018	Conference and Workshop Papers	conf/er/HewasinghageSB18	https://dblp.org/rec/conf/er/HewasinghageSB18	10.1007/978-3-030-00847-5_35	https://doi.org/10.1007/978-3-030-00847-5_35	URL#640469
640470	1	Managing Polyglot Systems Metadata with Hypergraphs.	463-478	2018	Conference and Workshop Papers	conf/er/HewasinghageVAZ18	https://dblp.org/rec/conf/er/HewasinghageVAZ18	10.1007/978-3-030-00847-5_33	https://doi.org/10.1007/978-3-030-00847-5_33	URL#640470
640471	1	Experiences Applying \hbox e3 Value Modeling in a Cross-Company Study.	610-625	2018	Conference and Workshop Papers	conf/er/HorkoffLHK18	https://dblp.org/rec/conf/er/HorkoffLHK18	10.1007/978-3-030-00847-5_45	https://doi.org/10.1007/978-3-030-00847-5_45	URL#640471
640472	1	Concepts in Quality Assessment for Machine Learning - From Test Data to Arguments.	536-544	2018	Conference and Workshop Papers	conf/er/Ishikawa18	https://dblp.org/rec/conf/er/Ishikawa18	10.1007/978-3-030-00847-5_39	https://doi.org/10.1007/978-3-030-00847-5_39	URL#640472
640474	1	Leveraging the Dynamic Changes from Items to Improve Recommendation.	507-520	2018	Conference and Workshop Papers	conf/er/JinZMWJ18	https://dblp.org/rec/conf/er/JinZMWJ18	10.1007/978-3-030-00847-5_37	https://doi.org/10.1007/978-3-030-00847-5_37	URL#640474
640477	1	Event-Context-Feedback Control Through Bridge Workflows for Smart Solutions.	626-634	2018	Conference and Workshop Papers	conf/er/KrishnaK18	https://dblp.org/rec/conf/er/KrishnaK18	10.1007/978-3-030-00847-5_46	https://doi.org/10.1007/978-3-030-00847-5_46	URL#640477
640479	1	A Holistic Approach for Soundness Verification of Decision-Aware Process Models.	219-235	2018	Conference and Workshop Papers	conf/er/LeoniFM18	https://dblp.org/rec/conf/er/LeoniFM18	10.1007/978-3-030-00847-5_17	https://doi.org/10.1007/978-3-030-00847-5_17	URL#640479
640480	1	Learning Restricted Regular Expressions with Interleaving from XML Data.	586-593	2018	Conference and Workshop Papers	conf/er/LiZXMC18	https://dblp.org/rec/conf/er/LiZXMC18	10.1007/978-3-030-00847-5_43	https://doi.org/10.1007/978-3-030-00847-5_43	URL#640480
640482	1	Realtime Event Summarization from Tweets with Inconsistency Detection.	555-570	2018	Conference and Workshop Papers	conf/er/LinLL18	https://dblp.org/rec/conf/er/LinLL18	10.1007/978-3-030-00847-5_41	https://doi.org/10.1007/978-3-030-00847-5_41	URL#640482
640486	1	Inductive Discovery by Machine Learning for Identification of Structural Models.	545-552	2018	Conference and Workshop Papers	conf/er/MaassS18	https://dblp.org/rec/conf/er/MaassS18	10.1007/978-3-030-00847-5_40	https://doi.org/10.1007/978-3-030-00847-5_40	URL#640486
640487	1	Automatic Generation of Security Compliant (Virtual) Model Views.	109-117	2018	Conference and Workshop Papers	conf/er/MartinezFGC18	https://dblp.org/rec/conf/er/MartinezFGC18	10.1007/978-3-030-00847-5_10	https://doi.org/10.1007/978-3-030-00847-5_10	URL#640487
640488	1	Towards Data Visualisation Based on Conceptual Modelling.	91-99	2018	Conference and Workshop Papers	conf/er/McBrienP18	https://dblp.org/rec/conf/er/McBrienP18	10.1007/978-3-030-00847-5_8	https://doi.org/10.1007/978-3-030-00847-5_8	URL#640488
640489	1	Renormalization of NoSQL Database Schemas.	479-487	2018	Conference and Workshop Papers	conf/er/MiorS18	https://dblp.org/rec/conf/er/MiorS18	10.1007/978-3-030-00847-5_34	https://doi.org/10.1007/978-3-030-00847-5_34	URL#640489
640490	1	Multi-perspective Comparison of Business Process Variants Based on Event Logs.	449-459	2018	Conference and Workshop Papers	conf/er/NguyenDRH18	https://dblp.org/rec/conf/er/NguyenDRH18	10.1007/978-3-030-00847-5_32	https://doi.org/10.1007/978-3-030-00847-5_32	URL#640490
640491	1	Towards the Design of a Scalable Business Process Management System Architecture in the Cloud.	334-348	2018	Conference and Workshop Papers	conf/er/OuyangAHY18	https://dblp.org/rec/conf/er/OuyangAHY18	10.1007/978-3-030-00847-5_24	https://doi.org/10.1007/978-3-030-00847-5_24	URL#640491
640493	1	A Method to Identify Relevant Genome Data - Conceptual Modeling for the Medicine of Precision.	597-609	2018	Conference and Workshop Papers	conf/er/PalacioLC18	https://dblp.org/rec/conf/er/PalacioLC18	10.1007/978-3-030-00847-5_44	https://doi.org/10.1007/978-3-030-00847-5_44	URL#640493
640499	1	Using Contextual Goal Models for Constructing Situational Methods.	440-448	2018	Conference and Workshop Papers	conf/er/RalyteF18	https://dblp.org/rec/conf/er/RalyteF18	10.1007/978-3-030-00847-5_31	https://doi.org/10.1007/978-3-030-00847-5_31	URL#640499
640500	1	A Volunteer Design Methodology of Data Warehouses.	286-300	2018	Conference and Workshop Papers	conf/er/SakkaBSCZB18	https://dblp.org/rec/conf/er/SakkaBSCZB18	10.1007/978-3-030-00847-5_21	https://doi.org/10.1007/978-3-030-00847-5_21	URL#640500
640501	1	The Common Ontology of Value and Risk.	121-135	2018	Conference and Workshop Papers	conf/er/SalesBGAGM18	https://dblp.org/rec/conf/er/SalesBGAGM18	10.1007/978-3-030-00847-5_11	https://doi.org/10.1007/978-3-030-00847-5_11	URL#640501
640502	1	Increasing the Semantic Transparency of the KAOS Goal Model Concrete Syntax.	424-439	2018	Conference and Workshop Papers	conf/er/SantosGGA18	https://dblp.org/rec/conf/er/SantosGGA18	10.1007/978-3-030-00847-5_30	https://doi.org/10.1007/978-3-030-00847-5_30	URL#640502
640505	1	Using a Conceptual Model to Transform Road Networks from OpenStreetMap to a Graph Database.	301-315	2018	Conference and Workshop Papers	conf/er/SteinmetzDMH18	https://dblp.org/rec/conf/er/SteinmetzDMH18	10.1007/978-3-030-00847-5_22	https://doi.org/10.1007/978-3-030-00847-5_22	URL#640505
640506	1	A Conceptual Framework for Supporting Deep Exploration of Business Process Behavior.	58-71	2018	Conference and Workshop Papers	conf/er/TsourySR18	https://dblp.org/rec/conf/er/TsourySR18	10.1007/978-3-030-00847-5_6	https://doi.org/10.1007/978-3-030-00847-5_6	URL#640506
640507	1	Empirical Comparison of Model Consistency Between Ontology-Driven Conceptual Modeling and Traditional Conceptual Modeling.	43-57	2018	Conference and Workshop Papers	conf/er/VerdonckPG18	https://dblp.org/rec/conf/er/VerdonckPG18	10.1007/978-3-030-00847-5_5	https://doi.org/10.1007/978-3-030-00847-5_5	URL#640507
640508	1	Inferring Deterministic Regular Expression with Counting.	184-199	2018	Conference and Workshop Papers	conf/er/WangC18	https://dblp.org/rec/conf/er/WangC18	10.1007/978-3-030-00847-5_15	https://doi.org/10.1007/978-3-030-00847-5_15	URL#640508
640510	1	An In-Depth Benchmarking Study on Bill of Materials for High-End Manufacturing.	75-90	2018	Conference and Workshop Papers	conf/er/WangMHLC18	https://dblp.org/rec/conf/er/WangMHLC18	10.1007/978-3-030-00847-5_7	https://doi.org/10.1007/978-3-030-00847-5_7	URL#640510
640512	1	Mining Rules with Constants from Large Scale Knowledge Bases.	521-535	2018	Conference and Workshop Papers	conf/er/WangZCF18	https://dblp.org/rec/conf/er/WangZCF18	10.1007/978-3-030-00847-5_38	https://doi.org/10.1007/978-3-030-00847-5_38	URL#640512
640515	1	Ontological Deep Data Cleaning.	100-108	2018	Conference and Workshop Papers	conf/er/WoodfieldSLLGE18	https://dblp.org/rec/conf/er/WoodfieldSLLGE18	10.1007/978-3-030-00847-5_9	https://doi.org/10.1007/978-3-030-00847-5_9	URL#640515
640517	1	Efficient Multi-range Query Processing on Trajectories.	269-285	2018	Conference and Workshop Papers	conf/er/YadamjavCBS18	https://dblp.org/rec/conf/er/YadamjavCBS18	10.1007/978-3-030-00847-5_20	https://doi.org/10.1007/978-3-030-00847-5_20	URL#640517
978854	1	A Catalogue of Reusable Context Model Elements Based on the i* Framework.	36-49	2017	Conference and Workshop Papers	conf/er/AbadPCF17	https://dblp.org/rec/conf/er/AbadPCF17	10.1007/978-3-319-69904-2_3	https://doi.org/10.1007/978-3-319-69904-2_3	URL#978854
978856	1	Goal-Oriented Regulatory Intelligence - How Can Watson Analytics Help?	77-91	2017	Conference and Workshop Papers	conf/er/AkhigbeHIAM17	https://dblp.org/rec/conf/er/AkhigbeHIAM17	10.1007/978-3-319-69904-2_7	https://doi.org/10.1007/978-3-319-69904-2_7	URL#978856
978858	1	A Comprehensive Formal Theory for Multi-level Conceptual Modeling.	280-294	2017	Conference and Workshop Papers	conf/er/AlmeidaFC17	https://dblp.org/rec/conf/er/AlmeidaFC17	10.1007/978-3-319-69904-2_23	https://doi.org/10.1007/978-3-319-69904-2_23	URL#978858
978859	1	User Perception of Numeric Contribution Semantics for Goal Models - An Exploratory Experiment.	451-465	2017	Conference and Workshop Papers	conf/er/AlothmanZL17	https://dblp.org/rec/conf/er/AlothmanZL17	10.1007/978-3-319-69904-2_34	https://doi.org/10.1007/978-3-319-69904-2_34	URL#978859
978862	1	Various Notions of Soundness for Decision-Aware Business Processes.	403-418	2017	Conference and Workshop Papers	conf/er/BatoulisHW17	https://dblp.org/rec/conf/er/BatoulisHW17	10.1007/978-3-319-69904-2_31	https://doi.org/10.1007/978-3-319-69904-2_31	URL#978862
978863	1	Conceptual Modeling for Genomics - Building an Integrated Repository of Open Data.	325-339	2017	Conference and Workshop Papers	conf/er/BernasconiCCM17	https://dblp.org/rec/conf/er/BernasconiCCM17	10.1007/978-3-319-69904-2_26	https://doi.org/10.1007/978-3-319-69904-2_26	URL#978863
978865	1	Conceptual Modelling of Autonomous Multi-cloud Interaction with Reflective Semantics.	120-133	2017	Conference and Workshop Papers	conf/er/BugaNS17	https://dblp.org/rec/conf/er/BugaNS17	10.1007/978-3-319-69904-2_10	https://doi.org/10.1007/978-3-319-69904-2_10	URL#978865
