id_work	score_work	info_title_work	info_pages_work	info_year_work	info_type_work	info_key_work	info_url_work	info_doi_work	info_ee_work	url_work
4716815	1	Levelled Entity Relationship Model.	420-436	1994	Conference and Workshop Papers	conf/er/GandhiRG94	https://dblp.org/rec/conf/er/GandhiRG94	10.1007/3-540-58786-1_94	https://doi.org/10.1007/3-540-58786-1_94	URL#4716815
4716816	1	Database Evolution - the DB-Main Approach.	112-131	1994	Conference and Workshop Papers	conf/er/HainautEHHR94	https://dblp.org/rec/conf/er/HainautEHHR94	10.1007/3-540-58786-1_76	https://doi.org/10.1007/3-540-58786-1_76	URL#4716816
4716817	1	Specifying Business Processes over Objects.	10-27	1994	Conference and Workshop Papers	conf/er/HartelJ94	https://dblp.org/rec/conf/er/HartelJ94	10.1007/3-540-58786-1_70	https://doi.org/10.1007/3-540-58786-1_70	URL#4716817
4716818	1	Deriving Complex Structured Object Types for Business Process Modelling.	28-45	1994	Conference and Workshop Papers	conf/er/JaeschkeOS94	https://dblp.org/rec/conf/er/JaeschkeOS94	10.1007/3-540-58786-1_71	https://doi.org/10.1007/3-540-58786-1_71	URL#4716818
4716820	1	An Executable Meta Model for Re-Engineering of Database Schemas.	533-547	1994	Conference and Workshop Papers	conf/er/JeusfeldJ94	https://dblp.org/rec/conf/er/JeusfeldJ94	10.1007/3-540-58786-1_100	https://doi.org/10.1007/3-540-58786-1_100	URL#4716820
4716821	1	COMan - Coexistence of Object-Oriented and Relational Technology.	259-277	1994	Conference and Workshop Papers	conf/er/KappelPPRRWG94	https://dblp.org/rec/conf/er/KappelPPRRWG94	10.1007/3-540-58786-1_84	https://doi.org/10.1007/3-540-58786-1_84	URL#4716821
4716822	1	A Normal Form Object-Oriented Entity Relationship Diagram.	241-258	1994	Conference and Workshop Papers	conf/er/LingT94	https://dblp.org/rec/conf/er/LingT94	10.1007/3-540-58786-1_83	https://doi.org/10.1007/3-540-58786-1_83	URL#4716822
4716823	1	Database Schema Evolution through the Specification and Maintenance of Changes on Entities and Relationships.	132-151	1994	Conference and Workshop Papers	conf/er/LiuCC94	https://dblp.org/rec/conf/er/LiuCC94	10.1007/3-540-58786-1_77	https://doi.org/10.1007/3-540-58786-1_77	URL#4716823
4716824	1	An Overview of the Lawrence Berkeley Laboratory Extended Entity-Relationship Database Tools.	333-350	1994	Conference and Workshop Papers	conf/er/MarkowitzS94	https://dblp.org/rec/conf/er/MarkowitzS94	10.1007/3-540-58786-1_89	https://doi.org/10.1007/3-540-58786-1_89	URL#4716824
4716825	1	What Makes a Good Data Model? Evaluating the Quality of Entity Relationship Models.	94-111	1994	Conference and Workshop Papers	conf/er/MoodyS94	https://dblp.org/rec/conf/er/MoodyS94	10.1007/3-540-58786-1_75	https://doi.org/10.1007/3-540-58786-1_75	URL#4716825
4716826	1	A Formal Software Specification Tool Using the Entity-Relationship Model.	315-332	1994	Conference and Workshop Papers	conf/er/Nagui-Raiss94	https://dblp.org/rec/conf/er/Nagui-Raiss94	10.1007/3-540-58786-1_88	https://doi.org/10.1007/3-540-58786-1_88	URL#4716826
4716827	1	An Assisting Method for Enterprise-wide Conceptual Data Modelling using the Bottom-up Approach.	64-78	1994	Conference and Workshop Papers	conf/er/NakawataseYKN94	https://dblp.org/rec/conf/er/NakawataseYKN94	10.1007/3-540-58786-1_73	https://doi.org/10.1007/3-540-58786-1_73	URL#4716827
4716828	1	Coordination System Modelling.	474-490	1994	Conference and Workshop Papers	conf/er/NorrieW94	https://dblp.org/rec/conf/er/NorrieW94	10.1007/3-540-58786-1_97	https://doi.org/10.1007/3-540-58786-1_97	URL#4716828
4716829	1	On the Representation of Objects with Polymorphic Shape and Behaviour.	223-240	1994	Conference and Workshop Papers	conf/er/PapazoglouKB94	https://dblp.org/rec/conf/er/PapazoglouKB94	10.1007/3-540-58786-1_82	https://doi.org/10.1007/3-540-58786-1_82	URL#4716829
4716830	1	Using Queries to Improve Database Reverse Engineering.	369-386	1994	Conference and Workshop Papers	conf/er/PetitKBT94	https://dblp.org/rec/conf/er/PetitKBT94	10.1007/3-540-58786-1_91	https://doi.org/10.1007/3-540-58786-1_91	URL#4716830
4716831	1	Reconstruction of ER Schema from Database Applications - a Cognitive Approach.	387-402	1994	Conference and Workshop Papers	conf/er/SignoreLGC94	https://dblp.org/rec/conf/er/SignoreLGC94	10.1007/3-540-58786-1_92	https://doi.org/10.1007/3-540-58786-1_92	URL#4716831
4716832	1	Virtual Structures - A Technique for Supporting Scientific Database Applications.	491-512	1994	Conference and Workshop Papers	conf/er/SmithSS94	https://dblp.org/rec/conf/er/SmithSS94	10.1007/3-540-58786-1_98	https://doi.org/10.1007/3-540-58786-1_98	URL#4716832
4716833	1	Method Restructuring and Consistency Checking for Object-Oriented Schemas.	152-170	1994	Conference and Workshop Papers	conf/er/TariL94	https://dblp.org/rec/conf/er/TariL94	10.1007/3-540-58786-1_78	https://doi.org/10.1007/3-540-58786-1_78	URL#4716833
4716834	1	State-Conditioned Semantics in Databases.	171-188	1994	Conference and Workshop Papers	conf/er/Thalheim94	https://dblp.org/rec/conf/er/Thalheim94	10.1007/3-540-58786-1_79	https://doi.org/10.1007/3-540-58786-1_79	URL#4716834
4716836	1	Formalised Conceptual Models as a Foundation of Information Systems Development.	437-455	1994	Conference and Workshop Papers	conf/er/Winter94	https://dblp.org/rec/conf/er/Winter94	10.1007/3-540-58786-1_95	https://doi.org/10.1007/3-540-58786-1_95	URL#4716836
4716837	1	Cardinality Consistency of Derived Objects in DOOD Systems.	278-295	1994	Conference and Workshop Papers	conf/er/YePS94	https://dblp.org/rec/conf/er/YePS94	10.1007/3-540-58786-1_85	https://doi.org/10.1007/3-540-58786-1_85	URL#4716837
4716838	1	From E-R to "A-R" - Modelling Strategic Actor Relationships for Business Process Reengineering.	548-565	1994	Conference and Workshop Papers	conf/er/YuM94	https://dblp.org/rec/conf/er/YuM94	10.1007/3-540-58786-1_101	https://doi.org/10.1007/3-540-58786-1_101	URL#4716838
4756900	1	Framework For Automatic Clustering of Semantic Models.	438-450	1993	Conference and Workshop Papers	conf/er/AkokaC93	https://dblp.org/rec/conf/er/AkokaC93	10.1007/BFB0024386	https://doi.org/10.1007/BFb0024386	URL#4756900
4756901	1	Relative Constraints in ER Data Models.	46-59	1993	Conference and Workshop Papers	conf/er/BehmT93	https://dblp.org/rec/conf/er/BehmT93	10.1007/BFB0024356	https://doi.org/10.1007/BFb0024356	URL#4756901
4756902	1	Reuse of Object-Oriented Requirements Specifications.	339-351	1993	Conference and Workshop Papers	conf/er/CastanoAP93	https://dblp.org/rec/conf/er/CastanoAP93	10.1007/BFB0024378	https://doi.org/10.1007/BFb0024378	URL#4756902
4756903	1	A State-Space Approach for Database Redesign.	520-530	1993	Conference and Workshop Papers	conf/er/Castilho93	https://dblp.org/rec/conf/er/Castilho93	10.1007/BFB0024392	https://doi.org/10.1007/BFb0024392	URL#4756903
4756904	1	Semantic Interoperability of Multitemporal Relational Databases.	463-474	1993	Conference and Workshop Papers	conf/er/CastroGS93	https://dblp.org/rec/conf/er/CastroGS93	10.1007/BFB0024388	https://doi.org/10.1007/BFb0024388	URL#4756904
4756905	1	Performance Evaluation of Reverse Engineering Relational Databases into Extended Entity-Relationship Models.	352-363	1993	Conference and Workshop Papers	conf/er/ChiangBS93	https://dblp.org/rec/conf/er/ChiangBS93	10.1007/BFB0024379	https://doi.org/10.1007/BFb0024379	URL#4756905
4756906	1	Towards a Unifying Logic Formalism for Semantic Data Models.	492-507	1993	Conference and Workshop Papers	conf/er/ChudziakRV93	https://dblp.org/rec/conf/er/ChudziakRV93	10.1007/BFB0024390	https://doi.org/10.1007/BFb0024390	URL#4756906
4756907	1	On Complex Objects and Versioning in Complex Environments.	13-23	1993	Conference and Workshop Papers	conf/er/Dijkstra93	https://dblp.org/rec/conf/er/Dijkstra93	10.1007/BFB0024353	https://doi.org/10.1007/BFb0024353	URL#4756907
4756908	1	DETERM - Deterministic Event-Tuned Entity-Relationship Modeling.	230-241	1993	Conference and Workshop Papers	conf/er/Falkenberg93	https://dblp.org/rec/conf/er/Falkenberg93	10.1007/BFB0024370	https://doi.org/10.1007/BFb0024370	URL#4756908
4756910	1	HDM2 - Extending the E-R Approach to Hypermedia Application Design.	178-189	1993	Conference and Workshop Papers	conf/er/GarzottoMP93	https://dblp.org/rec/conf/er/GarzottoMP93	10.1007/BFB0024366	https://doi.org/10.1007/BFb0024366	URL#4756910
4756911	1	Integrating the ER Approach in an OO Environment.	376-389	1993	Conference and Workshop Papers	conf/er/GogollaHCDV93	https://dblp.org/rec/conf/er/GogollaHCDV93	10.1007/BFB0024381	https://doi.org/10.1007/BFb0024381	URL#4756911
4756912	1	Temporal Extensions to a Uniform Behavioral Object Model.	110-121	1993	Conference and Workshop Papers	conf/er/GoralwallaO93	https://dblp.org/rec/conf/er/GoralwallaO93	10.1007/BFB0024361	https://doi.org/10.1007/BFb0024361	URL#4756912
4756913	1	Schema Transformation Techniques for Database Reverse Engineering.	364-375	1993	Conference and Workshop Papers	conf/er/HainautTJC93	https://dblp.org/rec/conf/er/HainautTJC93	10.1007/BFB0024380	https://doi.org/10.1007/BFb0024380	URL#4756913
4756914	1	A Repository Meta Model for Interactive Systems.	414-425	1993	Conference and Workshop Papers	conf/er/Hurley93	https://dblp.org/rec/conf/er/Hurley93	10.1007/BFB0024384	https://doi.org/10.1007/BFb0024384	URL#4756914
4756915	1	Extending ER Model Clustering by Relationship Clustering.	451-462	1993	Conference and Workshop Papers	conf/er/JaeschkeOS93	https://dblp.org/rec/conf/er/JaeschkeOS93	10.1007/BFB0024387	https://doi.org/10.1007/BFb0024387	URL#4756915
4756916	1	Using Conceptual Graph Theory to Support Schema Integration.	283-296	1993	Conference and Workshop Papers	conf/er/Johannesson93	https://dblp.org/rec/conf/er/Johannesson93	10.1007/BFB0024374	https://doi.org/10.1007/BFb0024374	URL#4756916
4756917	1	Modeling Time - Adequacy of Three Distinct Time Concepts for Temporal Databases.	475-491	1993	Conference and Workshop Papers	conf/er/KimC93	https://dblp.org/rec/conf/er/KimC93	10.1007/BFB0024389	https://doi.org/10.1007/BFb0024389	URL#4756917
4756918	1	Integration of Heterogeneous Object Schemas.	297-314	1993	Conference and Workshop Papers	conf/er/KohC93	https://dblp.org/rec/conf/er/KohC93	10.1007/BFB0024375	https://doi.org/10.1007/BFb0024375	URL#4756918
4756919	1	A Semantic Comparison of the Modelling Capabilities of the ER and NIAM Models.	242-256	1993	Conference and Workshop Papers	conf/er/LaenderF93	https://dblp.org/rec/conf/er/LaenderF93	10.1007/BFB0024371	https://doi.org/10.1007/BFb0024371	URL#4756919
4756920	1	Database Schema Design - A Perspective From Natural Language Techniques to Validation and View Integration.	190-205	1993	Conference and Workshop Papers	conf/er/MetaisML93	https://dblp.org/rec/conf/er/MetaisML93	10.1007/BFB0024367	https://doi.org/10.1007/BFb0024367	URL#4756920
4756921	1	Application and System Prototyping Via an Extensible Object-Oriented Environment.	24-33	1993	Conference and Workshop Papers	conf/er/MorsiN93	https://dblp.org/rec/conf/er/MorsiN93	10.1007/BFB0024354	https://doi.org/10.1007/BFb0024354	URL#4756921
4756922	1	On Mapping ER Models into OO Schemas.	402-413	1993	Conference and Workshop Papers	conf/er/NarasimhanNJ93	https://dblp.org/rec/conf/er/NarasimhanNJ93	10.1007/BFB0024383	https://doi.org/10.1007/BFb0024383	URL#4756922
4756923	1	An Extended Entity-Relationship Approach to Data Management in Object-Oriented Systems.	390-401	1993	Conference and Workshop Papers	conf/er/Norrie93	https://dblp.org/rec/conf/er/Norrie93	10.1007/BFB0024382	https://doi.org/10.1007/BFb0024382	URL#4756923
4756924	1	The Entity-Relationship Model for Multilevel Security.	166-177	1993	Conference and Workshop Papers	conf/er/PernulWT93	https://dblp.org/rec/conf/er/PernulWT93	10.1007/BFB0024365	https://doi.org/10.1007/BFb0024365	URL#4756924
4756925	1	Reflection in a Uniform Behavioral Object Model.	34-45	1993	Conference and Workshop Papers	conf/er/PetersO93	https://dblp.org/rec/conf/er/PetersO93	10.1007/BFB0024355	https://doi.org/10.1007/BFb0024355	URL#4756925
4756926	1	The Object Flow Model - A Formal Framework for Describing the Dynamic Construction, Destruction and Interaction of Complex Objects.	44166	1993	Conference and Workshop Papers	conf/er/PollaciaD93	https://dblp.org/rec/conf/er/PollaciaD93	10.1007/BFB0024352	https://doi.org/10.1007/BFb0024352	URL#4756926
4756927	1	Searching for Compositions in ER Schemes.	74-84	1993	Conference and Workshop Papers	conf/er/RauhS93	https://dblp.org/rec/conf/er/RauhS93	10.1007/BFB0024358	https://doi.org/10.1007/BFb0024358	URL#4756927
4756928	1	A Taxonomy for Schema Versioning Based on the Relational and Entity Relationship Models.	137-148	1993	Conference and Workshop Papers	conf/er/RoddickCR93	https://dblp.org/rec/conf/er/RoddickCR93	10.1007/BFB0024363	https://doi.org/10.1007/BFb0024363	URL#4756928
4756929	1	TOOSQL - A Temporal Object-Oriented Query Language.	122-136	1993	Conference and Workshop Papers	conf/er/RoseS93	https://dblp.org/rec/conf/er/RoseS93	10.1007/BFB0024362	https://doi.org/10.1007/BFb0024362	URL#4756929
4756930	1	ER-based Information Retrieval in a Mixed Database Environment.	426-437	1993	Conference and Workshop Papers	conf/er/RosengrenWBK93	https://dblp.org/rec/conf/er/RosengrenWBK93	10.1007/BFB0024385	https://doi.org/10.1007/BFb0024385	URL#4756930
4756931	1	Multilevel Schema Integration.	327-338	1993	Conference and Workshop Papers	conf/er/SantucciBB93	https://dblp.org/rec/conf/er/SantucciBB93	10.1007/BFB0024377	https://doi.org/10.1007/BFb0024377	URL#4756931
4756932	1	Analysis of Binary Relationships within Ternary Relationships in ER Modeling.	271-282	1993	Conference and Workshop Papers	conf/er/SongJ93	https://dblp.org/rec/conf/er/SongJ93	10.1007/BFB0024373	https://doi.org/10.1007/BFb0024373	URL#4756932
4756933	1	The Role of Metamodels in Federating System Modelling Techniques.	315-326	1993	Conference and Workshop Papers	conf/er/SteeleZ93	https://dblp.org/rec/conf/er/SteeleZ93	10.1007/BFB0024376	https://doi.org/10.1007/BFb0024376	URL#4756933
4756934	1	A Commonsense Reasoning Facility Based on the Entity-Relationship Model.	218-229	1993	Conference and Workshop Papers	conf/er/StoreyGCD93	https://dblp.org/rec/conf/er/StoreyGCD93	10.1007/BFB0024369	https://doi.org/10.1007/BFb0024369	URL#4756934
4756935	1	Transformation of Requirement Specifications Expressed in Natural Language into an EER Model.	206-217	1993	Conference and Workshop Papers	conf/er/TjoaB93	https://dblp.org/rec/conf/er/TjoaB93	10.1007/BFB0024368	https://doi.org/10.1007/BFb0024368	URL#4756935
4756936	1	From Entity-Relationship Models to Role-Attribute Models.	257-270	1993	Conference and Workshop Papers	conf/er/VelhoC93	https://dblp.org/rec/conf/er/VelhoC93	10.1007/BFB0024372	https://doi.org/10.1007/BFb0024372	URL#4756936
4756937	1	Functional Dependencies Generalized for Temporal Databases that Include Object-Identity.	99-109	1993	Conference and Workshop Papers	conf/er/WijsenVO93	https://dblp.org/rec/conf/er/WijsenVO93	10.1007/BFB0024360	https://doi.org/10.1007/BFb0024360	URL#4756937
4756938	1	Design and Implementation of Derived Entities.	60-73	1993	Conference and Workshop Papers	conf/er/Winter93	https://dblp.org/rec/conf/er/Winter93	10.1007/BFB0024357	https://doi.org/10.1007/BFb0024357	URL#4756938
4756939	1	Neighborhood/Conceptual Query Answering with Imprecise/Incomplete Data.	149-165	1993	Conference and Workshop Papers	conf/er/YenC93	https://dblp.org/rec/conf/er/YenC93	10.1007/BFB0024364	https://doi.org/10.1007/BFb0024364	URL#4756939
4756940	1	Enhancing the Quality of Conceptual Database Specifications through Validation.	85-98	1993	Conference and Workshop Papers	conf/er/ZamperoniL93	https://dblp.org/rec/conf/er/ZamperoniL93	10.1007/BFB0024359	https://doi.org/10.1007/BFb0024359	URL#4756940
4793981	1	SUPER - Visual Interaction with an Object-Based ER Model.	340-356	1992	Conference and Workshop Papers	conf/er/AuddinoDDFST92	https://dblp.org/rec/conf/er/AuddinoDDFST92	10.1007/3-540-56023-8_21	https://doi.org/10.1007/3-540-56023-8_21	URL#4793981
4793982	1	Natural Language Restatement of Queries Expressed in a Graphical Language.	357-374	1992	Conference and Workshop Papers	conf/er/BonoF92	https://dblp.org/rec/conf/er/BonoF92	10.1007/3-540-56023-8_22	https://doi.org/10.1007/3-540-56023-8_22	URL#4793982
4793983	1	Unified Class Evolution by Object-Oriented Views.	423-439	1992	Conference and Workshop Papers	conf/er/Bratsberg92	https://dblp.org/rec/conf/er/Bratsberg92	10.1007/3-540-56023-8_26	https://doi.org/10.1007/3-540-56023-8_26	URL#4793983
4793985	1	The Use of a Lexicon to Interpret ER-Diagrams - A LIKE project.	162-177	1992	Conference and Workshop Papers	conf/er/BuitelaarR92	https://dblp.org/rec/conf/er/BuitelaarR92	10.1007/3-540-56023-8_11	https://doi.org/10.1007/3-540-56023-8_11	URL#4793985
4793986	1	Classifying and Reusing Conceptual Schemas.	121-138	1992	Conference and Workshop Papers	conf/er/CastanoAZ92	https://dblp.org/rec/conf/er/CastanoAZ92	10.1007/3-540-56023-8_9	https://doi.org/10.1007/3-540-56023-8_9	URL#4793986
4793988	1	A Temporal Query Language Based on Conceptual Entities and Roles.	375-388	1992	Conference and Workshop Papers	conf/er/ElmasriK92	https://dblp.org/rec/conf/er/ElmasriK92	10.1007/3-540-56023-8_23	https://doi.org/10.1007/3-540-56023-8_23	URL#4793988
4793989	1	A Specification-Based Data Model.	194-209	1992	Conference and Workshop Papers	conf/er/Gandhi92	https://dblp.org/rec/conf/er/Gandhi92	10.1007/3-540-56023-8_13	https://doi.org/10.1007/3-540-56023-8_13	URL#4793989
4793990	1	An Entity-Relationship-Based Methodology for Distributed Database Design - An Integrated Approach Towards Combined Logical and Distribution Designs.	178-193	1992	Conference and Workshop Papers	conf/er/GarciaS92	https://dblp.org/rec/conf/er/GarciaS92	10.1007/3-540-56023-8_12	https://doi.org/10.1007/3-540-56023-8_12	URL#4793990
4793991	1	A Temporal Statistical Model for Entity-Relationship Schemas.	79-96	1992	Conference and Workshop Papers	conf/er/Hainaut92	https://dblp.org/rec/conf/er/Hainaut92	10.1007/3-540-56023-8_7	https://doi.org/10.1007/3-540-56023-8_7	URL#4793991
4793992	1	"Part" Relations for Object-Oriented Databases.	406-422	1992	Conference and Workshop Papers	conf/er/HalperGP92	https://dblp.org/rec/conf/er/HalperGP92	10.1007/3-540-56023-8_25	https://doi.org/10.1007/3-540-56023-8_25	URL#4793992
4793993	1	Transforming Conceptual Data Models into an Object Model.	280-298	1992	Conference and Workshop Papers	conf/er/HerzigG92	https://dblp.org/rec/conf/er/HerzigG92	10.1007/3-540-56023-8_18	https://doi.org/10.1007/3-540-56023-8_18	URL#4793993
4793994	1	Local Referential Integrity.	41-61	1992	Conference and Workshop Papers	conf/er/KappelS92	https://dblp.org/rec/conf/er/KappelS92	10.1007/3-540-56023-8_5	https://doi.org/10.1007/3-540-56023-8_5	URL#4793994
4793995	1	An EER Prototyping Environment and its Implemetation in a Datalog Language.	243-261	1992	Conference and Workshop Papers	conf/er/KehrerN92	https://dblp.org/rec/conf/er/KehrerN92	10.1007/3-540-56023-8_16	https://doi.org/10.1007/3-540-56023-8_16	URL#4793995
4793996	1	A Theory for Entity-Relationship View Updates.	262-279	1992	Conference and Workshop Papers	conf/er/LingL92	https://dblp.org/rec/conf/er/LingL92	10.1007/3-540-56023-8_17	https://doi.org/10.1007/3-540-56023-8_17	URL#4793996
4793997	1	Nesting Quantification in a Visual Data Manipulation Language.	226-242	1992	Conference and Workshop Papers	conf/er/Miura92	https://dblp.org/rec/conf/er/Miura92	10.1007/3-540-56023-8_15	https://doi.org/10.1007/3-540-56023-8_15	URL#4793997
4793999	1	Data Dictionary Design - A Logic Programming Approach.	210-225	1992	Conference and Workshop Papers	conf/er/PirriP92	https://dblp.org/rec/conf/er/PirriP92	10.1007/3-540-56023-8_14	https://doi.org/10.1007/3-540-56023-8_14	URL#4793999
4794000	1	Entity Tree Clustering - A Method for Simplifying ER Designs.	62-78	1992	Conference and Workshop Papers	conf/er/RauhS92	https://dblp.org/rec/conf/er/RauhS92	10.1007/3-540-56023-8_6	https://doi.org/10.1007/3-540-56023-8_6	URL#4794000
4794002	1	Semantic Similarity Relations in Schema Integration.	97-120	1992	Conference and Workshop Papers	conf/er/SongJB92	https://dblp.org/rec/conf/er/SongJB92	10.1007/3-540-56023-8_8	https://doi.org/10.1007/3-540-56023-8_8	URL#4794002
4794003	1	A Design Methodology for Object Oriented Databases.	389-405	1992	Conference and Workshop Papers	conf/er/Tari92	https://dblp.org/rec/conf/er/Tari92	10.1007/3-540-56023-8_24	https://doi.org/10.1007/3-540-56023-8_24	URL#4794003
4794004	1	Fundamentals of Cardinality Constraints.	7-23	1992	Conference and Workshop Papers	conf/er/Thalheim92	https://dblp.org/rec/conf/er/Thalheim92	10.1007/3-540-56023-8_3	https://doi.org/10.1007/3-540-56023-8_3	URL#4794004
4794005	1	Meta Object Management and its Application to Database Evolution.	299-321	1992	Conference and Workshop Papers	conf/er/TreschS92	https://dblp.org/rec/conf/er/TreschS92	10.1007/3-540-56023-8_19	https://doi.org/10.1007/3-540-56023-8_19	URL#4794005
4794006	1	Evaluation of Complex Cardinality Constraints.	24-40	1992	Conference and Workshop Papers	conf/er/ZhouB92	https://dblp.org/rec/conf/er/ZhouB92	10.1007/3-540-56023-8_4	https://doi.org/10.1007/3-540-56023-8_4	URL#4794006
4824233	1	Semantic Modelling and Object-Oriented Modelling - Two Complementary Paradigms.	325-348	1991	Conference and Workshop Papers	conf/er/BouzeghoubM91	https://dblp.org/rec/conf/er/BouzeghoubM91			URL#4824233
4824236	1	An Analysis of Table Constraints in SQL2 Based on the Entity-Relationship Model.	623-641	1991	Conference and Workshop Papers	conf/er/CasanovaCRL91	https://dblp.org/rec/conf/er/CasanovaCRL91			URL#4824236
4824237	1	Rapid Prototyping of Conceptual Database Design on a Relational Database Management System.	93-109	1991	Conference and Workshop Papers	conf/er/ChaoK91	https://dblp.org/rec/conf/er/ChaoK91			URL#4824237
4824238	1	Cardinality Constraints in Entity-Relationship Modeling.	1-30	1991	Conference and Workshop Papers	conf/er/Ferg91	https://dblp.org/rec/conf/er/Ferg91			URL#4824238
4824240	1	Drafting Extended Entity-Relationship Schemas with QUEER.	561-585	1991	Conference and Workshop Papers	conf/er/GogollaMW91	https://dblp.org/rec/conf/er/GogollaMW91			URL#4824240
4824241	1	Commonsense Reasoning in Database Design.	77-91	1991	Conference and Workshop Papers	conf/er/GoldsteinS91	https://dblp.org/rec/conf/er/GoldsteinS91			URL#4824241
4824242	1	Semantic Modelling of an Accounting Universe of Discourse - The Usefulness of Inter-Relation Constraints.	263-283	1991	Conference and Workshop Papers	conf/er/Guido91	https://dblp.org/rec/conf/er/Guido91			URL#4824242
4824243	1	Entity-Generating Schema Transformations for Entity-Relationship Models.	643-670	1991	Conference and Workshop Papers	conf/er/Hainaut91	https://dblp.org/rec/conf/er/Hainaut91			URL#4824243
4824245	1	Cooperative Behavior Through Request Modification.	607-621	1991	Conference and Workshop Papers	conf/er/HemerlyCF91	https://dblp.org/rec/conf/er/HemerlyCF91			URL#4824245
4824246	1	ER-T Diagrams - An Approach to Specifying Database Transactions.	247-262	1991	Conference and Workshop Papers	conf/er/HeuserP91	https://dblp.org/rec/conf/er/HeuserP91			URL#4824246
4824247	1	A Language for Specifying Static and Dynamic Integrity Constraints.	389-416	1991	Conference and Workshop Papers	conf/er/HohensteinH91	https://dblp.org/rec/conf/er/HohensteinH91			URL#4824247
4824248	1	Progessive Fragment Allocation.	543-560	1991	Conference and Workshop Papers	conf/er/JanakiramanWBT91	https://dblp.org/rec/conf/er/JanakiramanWBT91			URL#4824248
4824249	1	A Logic Based Approach to Schema Integration.	147-161	1991	Conference and Workshop Papers	conf/er/Johannesson91	https://dblp.org/rec/conf/er/Johannesson91			URL#4824249
4824250	1	Language Features for Object-Oriented Conceptual Modelling.	309-324	1991	Conference and Workshop Papers	conf/er/JungclausSH91	https://dblp.org/rec/conf/er/JungclausSH91			URL#4824250
4824251	1	Bridging the Gap Between O-O and E-R.	445-458	1991	Conference and Workshop Papers	conf/er/Kilian91	https://dblp.org/rec/conf/er/Kilian91			URL#4824251
4824252	1	Mapping of 2-D Temporal Extended ER Models into Temporal Nested Relational Models.	671-691	1991	Conference and Workshop Papers	conf/er/KouramajianE91	https://dblp.org/rec/conf/er/KouramajianE91			URL#4824252
4824253	1	A Prolog Implementation of an Entity-Relationship Based Database Management System.	587-605	1991	Conference and Workshop Papers	conf/er/LingL91	https://dblp.org/rec/conf/er/LingL91			URL#4824253
4824254	1	On the Notion of Concept.	349-370	1991	Conference and Workshop Papers	conf/er/LockemannM91	https://dblp.org/rec/conf/er/LockemannM91			URL#4824254
4824256	1	From Entity-Relationship Diagram to an Object-Oriented Database.	459-481	1991	Conference and Workshop Papers	conf/er/NachoukiCB91	https://dblp.org/rec/conf/er/NachoukiCB91			URL#4824256
4824257	1	A Transaction Architecture for a General Purpose Semantic Data Model.	511-541	1991	Conference and Workshop Papers	conf/er/NavatheB91	https://dblp.org/rec/conf/er/NavatheB91			URL#4824257
4824259	1	A View Integration Approach for the Design of Multilevel Security.	483-509	1991	Conference and Workshop Papers	conf/er/PernulT91	https://dblp.org/rec/conf/er/PernulT91			URL#4824259
4824260	1	TOODM - A Temporal Object-Oriented Data Model with Temporal Constraints.	205-229	1991	Conference and Workshop Papers	conf/er/RoseS91	https://dblp.org/rec/conf/er/RoseS91			URL#4824260
4824262	1	Cooperation Contracts.	285-307	1991	Conference and Workshop Papers	conf/er/SchreflK91	https://dblp.org/rec/conf/er/SchreflK91			URL#4824262
4824263	1	Abbreviation Techniques in Entity-Relationship Query Languages.	129-145	1991	Conference and Workshop Papers	conf/er/Sciore91	https://dblp.org/rec/conf/er/Sciore91			URL#4824263
4824264	1	Creative Data Modelling - Encouraging Innovation in Data Design.	111-128	1991	Conference and Workshop Papers	conf/er/Simsion91	https://dblp.org/rec/conf/er/Simsion91			URL#4824264
