id_work	score_work	info_title_work	info_pages_work	info_year_work	info_type_work	info_key_work	info_url_work	info_doi_work	info_ee_work	url_work
3996363	1	Graphical Reasoning for Sets of Functional Dependencies.	166-179	2004	Conference and Workshop Papers	conf/er/DemetrovicsMT04	https://dblp.org/rec/conf/er/DemetrovicsMT04	10.1007/978-3-540-30464-7_14	https://doi.org/10.1007/978-3-540-30464-7_14	URL#3996363
3996365	1	Multi-phase Process Mining - Building Instance Graphs.	362-376	2004	Conference and Workshop Papers	conf/er/DongenA04	https://dblp.org/rec/conf/er/DongenA04	10.1007/978-3-540-30464-7_29	https://doi.org/10.1007/978-3-540-30464-7_29	URL#3996365
3996367	1	Risk-Driven Conceptual Modeling of Outsourcing Decisions.	709-723	2004	Conference and Workshop Papers	conf/er/EckWG04	https://dblp.org/rec/conf/er/EckWG04	10.1007/978-3-540-30464-7_53	https://doi.org/10.1007/978-3-540-30464-7_53	URL#3996367
3996368	1	Enterprise Modeling with Conceptual XML.	150-165	2004	Conference and Workshop Papers	conf/er/EmbleyLA04	https://dblp.org/rec/conf/er/EmbleyLA04	10.1007/978-3-540-30464-7_13	https://doi.org/10.1007/978-3-540-30464-7_13	URL#3996368
3996369	1	Expressive Profile Specification and Its Semantics for a Web Monitoring System.	420-433	2004	Conference and Workshop Papers	conf/er/EppiliJSC04	https://dblp.org/rec/conf/er/EppiliJSC04	10.1007/978-3-540-30464-7_33	https://doi.org/10.1007/978-3-540-30464-7_33	URL#3996369
3996370	1	Schema Evolution in Data Warehousing Environments - A Schema Transformation-Based Approach.	639-653	2004	Conference and Workshop Papers	conf/er/FanP04	https://dblp.org/rec/conf/er/FanP04	10.1007/978-3-540-30464-7_48	https://doi.org/10.1007/978-3-540-30464-7_48	URL#3996370
3996371	1	An Agent-Based Approach for Interleaved Composition and Execution of Web Services.	582-595	2004	Conference and Workshop Papers	conf/er/FanUYP04	https://dblp.org/rec/conf/er/FanUYP04	10.1007/978-3-540-30464-7_44	https://doi.org/10.1007/978-3-540-30464-7_44	URL#3996371
3996373	1	Extending UML for Designing Secure Data Warehouses.	217-230	2004	Conference and Workshop Papers	conf/er/Fernandez-MedinaTVP04	https://dblp.org/rec/conf/er/Fernandez-MedinaTVP04	10.1007/978-3-540-30464-7_18	https://doi.org/10.1007/978-3-540-30464-7_18	URL#3996373
3996375	1	Schema-Based Web Wrapping.	286-299	2004	Conference and Workshop Papers	conf/er/FlescaT04	https://dblp.org/rec/conf/er/FlescaT04	10.1007/978-3-540-30464-7_23	https://doi.org/10.1007/978-3-540-30464-7_23	URL#3996375
3996379	1	Expressing and Optimizing Similarity-Based Queries in SQL.	464-478	2004	Conference and Workshop Papers	conf/er/GaoWWP04	https://dblp.org/rec/conf/er/GaoWWP04	10.1007/978-3-540-30464-7_36	https://doi.org/10.1007/978-3-540-30464-7_36	URL#3996379
3996386	1	Data Integration with Preferences Among Sources.	231-244	2004	Conference and Workshop Papers	conf/er/GrecoL04	https://dblp.org/rec/conf/er/GrecoL04	10.1007/978-3-540-30464-7_19	https://doi.org/10.1007/978-3-540-30464-7_19	URL#3996386
3996389	1	Contextual Probability-Based Classification.	313-326	2004	Conference and Workshop Papers	conf/er/GuoWBL04	https://dblp.org/rec/conf/er/GuoWBL04	10.1007/978-3-540-30464-7_25	https://doi.org/10.1007/978-3-540-30464-7_25	URL#3996389
3996392	1	Resolving Schematic Discrepancy in the Integration of Entity-Relationship Schemas.	245-258	2004	Conference and Workshop Papers	conf/er/HeL04	https://dblp.org/rec/conf/er/HeL04	10.1007/978-3-540-30464-7_20	https://doi.org/10.1007/978-3-540-30464-7_20	URL#3996392
3996393	1	Use of Tabular Analysis Method to Construct UML Sequence Diagrams.	740-752	2004	Conference and Workshop Papers	conf/er/HilsbosS04	https://dblp.org/rec/conf/er/HilsbosS04	10.1007/978-3-540-30464-7_55	https://doi.org/10.1007/978-3-540-30464-7_55	URL#3996393
3996394	1	Situated Preferences and Preference Repositories for Personalized Database Applications.	511-523	2004	Conference and Workshop Papers	conf/er/HollandK04	https://dblp.org/rec/conf/er/HollandK04	10.1007/978-3-540-30464-7_39	https://doi.org/10.1007/978-3-540-30464-7_39	URL#3996394
3996396	1	A New XML Clustering for Structural Retrieval.	377-387	2004	Conference and Workshop Papers	conf/er/HwangR04	https://dblp.org/rec/conf/er/HwangR04	10.1007/978-3-540-30464-7_30	https://doi.org/10.1007/978-3-540-30464-7_30	URL#3996396
3996397	1	A Probabilistic QoS Model and Computation Framework for Web Services-Based Workflows.	596-609	2004	Conference and Workshop Papers	conf/er/HwangWSP04	https://dblp.org/rec/conf/er/HwangWSP04	10.1007/978-3-540-30464-7_45	https://doi.org/10.1007/978-3-540-30464-7_45	URL#3996397
3996399	1	Lossless Conditional Schema Evolution.	610-623	2004	Conference and Workshop Papers	conf/er/JensenB04a	https://dblp.org/rec/conf/er/JensenB04a	10.1007/978-3-540-30464-7_46	https://doi.org/10.1007/978-3-540-30464-7_46	URL#3996399
3996404	1	Ontological Approaches to Enterprise Applications.	838-840	2004	Conference and Workshop Papers	conf/er/KimCLL04	https://dblp.org/rec/conf/er/KimCLL04	10.1007/978-3-540-30464-7_65	https://doi.org/10.1007/978-3-540-30464-7_65	URL#3996404
3996407	1	Metaprogramming for Relational Databases.	654-667	2004	Conference and Workshop Papers	conf/er/Kovse0H04	https://dblp.org/rec/conf/er/Kovse0H04	10.1007/978-3-540-30464-7_49	https://doi.org/10.1007/978-3-540-30464-7_49	URL#3996407
3996415	1	Intentional Modeling to Support Identity Management.	555-566	2004	Conference and Workshop Papers	conf/er/LiuY04	https://dblp.org/rec/conf/er/LiuY04	10.1007/978-3-540-30464-7_42	https://doi.org/10.1007/978-3-540-30464-7_42	URL#3996415
3996417	1	Managing Merged Data by Vague Functional Dependencies.	259-272	2004	Conference and Workshop Papers	conf/er/LuN04	https://dblp.org/rec/conf/er/LuN04	10.1007/978-3-540-30464-7_21	https://doi.org/10.1007/978-3-540-30464-7_21	URL#3996417
3996418	1	Data Mapping Diagrams for Data Warehouse Design with UML.	191-204	2004	Conference and Workshop Papers	conf/er/Lujan-MoraVT04	https://dblp.org/rec/conf/er/Lujan-MoraVT04	10.1007/978-3-540-30464-7_16	https://doi.org/10.1007/978-3-540-30464-7_16	URL#3996418
3996423	1	Load-Balancing Remote Spatial Join Queries in a Spatial GRID.	450-463	2004	Conference and Workshop Papers	conf/er/MondalK04	https://dblp.org/rec/conf/er/MondalK04	10.1007/978-3-540-30464-7_35	https://doi.org/10.1007/978-3-540-30464-7_35	URL#3996423
3996425	1	Definition of Events and Their Effects in Object-Oriented Conceptual Modeling Languages.	136-149	2004	Conference and Workshop Papers	conf/er/Olive04	https://dblp.org/rec/conf/er/Olive04	10.1007/978-3-540-30464-7_12	https://doi.org/10.1007/978-3-540-30464-7_12	URL#3996425
3996428	1	Link Patterns for Modeling Information Grids and P2P Networks.	388-401	2004	Conference and Workshop Papers	conf/er/PopfingerLC04	https://dblp.org/rec/conf/er/PopfingerLC04	10.1007/978-3-540-30464-7_31	https://doi.org/10.1007/978-3-540-30464-7_31	URL#3996428
3996430	1	Efficient Recursive XML Query Processing in Relational Database Systems.	493-510	2004	Conference and Workshop Papers	conf/er/PrakashBM04	https://dblp.org/rec/conf/er/PrakashBM04	10.1007/978-3-540-30464-7_38	https://doi.org/10.1007/978-3-540-30464-7_38	URL#3996430
3996431	1	Informational Scenarios for Data Warehouse Requirements Elicitation.	205-216	2004	Conference and Workshop Papers	conf/er/PrakashSG04	https://dblp.org/rec/conf/er/PrakashSG04	10.1007/978-3-540-30464-7_17	https://doi.org/10.1007/978-3-540-30464-7_17	URL#3996431
3996433	1	Ontology-Guided Change Detection to the Semantic Web Data.	624-638	2004	Conference and Workshop Papers	conf/er/QinA04	https://dblp.org/rec/conf/er/QinA04	10.1007/978-3-540-30464-7_47	https://doi.org/10.1007/978-3-540-30464-7_47	URL#3996433
3996434	1	Modeling the Semantics of 3D Protein Structures.	696-708	2004	Conference and Workshop Papers	conf/er/RamW04	https://dblp.org/rec/conf/er/RamW04	10.1007/978-3-540-30464-7_52	https://doi.org/10.1007/978-3-540-30464-7_52	URL#3996434
3996435	1	A Reference Methodology for Conducting Ontological Analyses.	110-121	2004	Conference and Workshop Papers	conf/er/RosemannGI04	https://dblp.org/rec/conf/er/RosemannGI04	10.1007/978-3-540-30464-7_10	https://doi.org/10.1007/978-3-540-30464-7_10	URL#3996435
3996438	1	Modeling Functional Data Sources as Relations.	55-68	2004	Conference and Workshop Papers	conf/er/SantiniG04	https://dblp.org/rec/conf/er/SantiniG04	10.1007/978-3-540-30464-7_6	https://doi.org/10.1007/978-3-540-30464-7_6	URL#3996438
3996441	1	Entity-Relationship Modeling Re-revisited.	43-54	2004	Conference and Workshop Papers	conf/er/Song04	https://dblp.org/rec/conf/er/Song04	10.1007/978-3-540-30464-7_5	https://doi.org/10.1007/978-3-540-30464-7_5	URL#3996441
3996443	1	On Modelling Cooperative Retrieval Using an Ontology-Based Query Refinement Process.	434-449	2004	Conference and Workshop Papers	conf/er/StojanovicS04	https://dblp.org/rec/conf/er/StojanovicS04	10.1007/978-3-540-30464-7_34	https://doi.org/10.1007/978-3-540-30464-7_34	URL#3996443
3996444	1	Understanding Relationships - Classifying Verb Phrase Semantics.	336-347	2004	Conference and Workshop Papers	conf/er/StoreyP04	https://dblp.org/rec/conf/er/StoreyP04	10.1007/978-3-540-30464-7_27	https://doi.org/10.1007/978-3-540-30464-7_27	URL#3996444
3996445	1	Applying the Application-Based Domain Modeling Approach to UML Structural Views.	766-779	2004	Conference and Workshop Papers	conf/er/SturmR04	https://dblp.org/rec/conf/er/SturmR04	10.1007/978-3-540-30464-7_57	https://doi.org/10.1007/978-3-540-30464-7_57	URL#3996445
3996447	1	WUML - A Web Usage Manipulation Language for Querying Web Log Data.	567-581	2004	Conference and Workshop Papers	conf/er/TanKN04	https://dblp.org/rec/conf/er/TanKN04	10.1007/978-3-540-30464-7_43	https://doi.org/10.1007/978-3-540-30464-7_43	URL#3996447
3996448	1	ER-Based Software Sizing for Data-Intensive Systems.	180-190	2004	Conference and Workshop Papers	conf/er/TanZ04	https://dblp.org/rec/conf/er/TanZ04	10.1007/978-3-540-30464-7_15	https://doi.org/10.1007/978-3-540-30464-7_15	URL#3996448
3996450	1	GiSA - A Grid System for Genome Sequences Assembly.	831-833	2004	Conference and Workshop Papers	conf/er/TangHWWS04	https://dblp.org/rec/conf/er/TangHWWS04	10.1007/978-3-540-30464-7_63	https://doi.org/10.1007/978-3-540-30464-7_63	URL#3996450
3996453	1	FASTAXON - A System for FAST (and Faceted) TAXONomy Design.	841-843	2004	Conference and Workshop Papers	conf/er/TzitzikasLHKLSTUV04	https://dblp.org/rec/conf/er/TzitzikasLHKLSTUV04	10.1007/978-3-540-30464-7_66	https://doi.org/10.1007/978-3-540-30464-7_66	URL#3996453
3996454	1	CLOVE - A Framework to Design Ontology Views.	844-849	2004	Conference and Workshop Papers	conf/er/Uceda-SosaCC04	https://dblp.org/rec/conf/er/Uceda-SosaCC04	10.1007/978-3-540-30464-7_67	https://doi.org/10.1007/978-3-540-30464-7_67	URL#3996454
3996455	1	A Model Driven Approach for XML Database Development.	780-794	2004	Conference and Workshop Papers	conf/er/VelaAM04	https://dblp.org/rec/conf/er/VelaAM04	10.1007/978-3-540-30464-7_58	https://doi.org/10.1007/978-3-540-30464-7_58	URL#3996455
3996456	1	Modeling Default Induction with Conceptual Structures.	83-95	2004	Conference and Workshop Papers	conf/er/VelcinG04	https://dblp.org/rec/conf/er/VelcinG04	10.1007/978-3-540-30464-7_8	https://doi.org/10.1007/978-3-540-30464-7_8	URL#3996456
3996457	1	Reachability Problems in Entity-Relationship Schema Instances.	96-109	2004	Conference and Workshop Papers	conf/er/Vigna04	https://dblp.org/rec/conf/er/Vigna04	10.1007/978-3-540-30464-7_9	https://doi.org/10.1007/978-3-540-30464-7_9	URL#3996457
3996460	1	On the Updatability of XML Views Published over Relational Data.	795-809	2004	Conference and Workshop Papers	conf/er/WangR04	https://dblp.org/rec/conf/er/WangR04	10.1007/978-3-540-30464-7_59	https://doi.org/10.1007/978-3-540-30464-7_59	URL#3996460
3996462	1	Improving the Performance of Decision Tree - A Hybrid Approach.	327-335	2004	Conference and Workshop Papers	conf/er/WangYLL04	https://dblp.org/rec/conf/er/WangYLL04	10.1007/978-3-540-30464-7_26	https://doi.org/10.1007/978-3-540-30464-7_26	URL#3996462
3996463	1	XBiT - An XML-Based Bitemporal Data Model.	810-824	2004	Conference and Workshop Papers	conf/er/WangZ04	https://dblp.org/rec/conf/er/WangZ04	10.1007/978-3-540-30464-7_60	https://doi.org/10.1007/978-3-540-30464-7_60	URL#3996463
3996465	1	XSLTGen - A System for Automatically Generating XML Transformations via Semantic Mappings.	479-492	2004	Conference and Workshop Papers	conf/er/WaworuntuB04	https://dblp.org/rec/conf/er/WaworuntuB04	10.1007/978-3-540-30464-7_37	https://doi.org/10.1007/978-3-540-30464-7_37	URL#3996465
3996466	1	Merging of XML Documents.	273-285	2004	Conference and Workshop Papers	conf/er/WeiLL04	https://dblp.org/rec/conf/er/WeiLL04	10.1007/978-3-540-30464-7_22	https://doi.org/10.1007/978-3-540-30464-7_22	URL#3996466
3996469	1	Semantic Interpretation and Matching of Web Services.	542-554	2004	Conference and Workshop Papers	conf/er/XuCX04	https://dblp.org/rec/conf/er/XuCX04	10.1007/978-3-540-30464-7_41	https://doi.org/10.1007/978-3-540-30464-7_41	URL#3996469
3996470	1	Fast Mining Maximal Frequent ItemSets Based on FP-Tree.	348-361	2004	Conference and Workshop Papers	conf/er/YanLC04	https://dblp.org/rec/conf/er/YanLC04	10.1007/978-3-540-30464-7_28	https://doi.org/10.1007/978-3-540-30464-7_28	URL#3996470
3996472	1	Analytical View of Business Data - An Example.	834-837	2004	Conference and Workshop Papers	conf/er/YehTJS04	https://dblp.org/rec/conf/er/YehTJS04	10.1007/978-3-540-30464-7_64	https://doi.org/10.1007/978-3-540-30464-7_64	URL#3996472
3996474	1	An Approach to Formalizing the Semantics of UML Statecharts.	753-765	2004	Conference and Workshop Papers	conf/er/ZhanM04	https://dblp.org/rec/conf/er/ZhanM04	10.1007/978-3-540-30464-7_56	https://doi.org/10.1007/978-3-540-30464-7_56	URL#3996474
3996475	1	Web Taxonomy Integration Using Spectral Graph Transducer.	300-312	2004	Conference and Workshop Papers	conf/er/ZhangWD04	https://dblp.org/rec/conf/er/ZhangWD04	10.1007/978-3-540-30464-7_24	https://doi.org/10.1007/978-3-540-30464-7_24	URL#3996475
4119073	1	Statistical Analysis as Methodological Framework for Data(base) Integration.	17-30	2003	Conference and Workshop Papers	conf/er/AltarevaC03	https://dblp.org/rec/conf/er/AltarevaC03	10.1007/978-3-540-39648-2_5	https://doi.org/10.1007/978-3-540-39648-2_5	URL#4119073
4119078	1	The Uni-level Description - A Uniform Framework for Representing Information in Multiple Data Models.	45-58	2003	Conference and Workshop Papers	conf/er/BowersD03	https://dblp.org/rec/conf/er/BowersD03	10.1007/978-3-540-39648-2_7	https://doi.org/10.1007/978-3-540-39648-2_7	URL#4119078
4119079	1	Extending Hypertext Conceptual Models with Process-Oriented Primitives.	246-262	2003	Conference and Workshop Papers	conf/er/Brambilla03	https://dblp.org/rec/conf/er/Brambilla03	10.1007/978-3-540-39648-2_21	https://doi.org/10.1007/978-3-540-39648-2_21	URL#4119079
4119081	1	Bless the ODS.	565-566	2003	Conference and Workshop Papers	conf/er/BryanT03	https://dblp.org/rec/conf/er/BryanT03	10.1007/978-3-540-39648-2_44	https://doi.org/10.1007/978-3-540-39648-2_44	URL#4119081
4119082	1	A Heuristic-Based Methodology for Semantic Augmentation of User Queries on the Web.	476-489	2003	Conference and Workshop Papers	conf/er/Burton-JonesSSP03	https://dblp.org/rec/conf/er/Burton-JonesSSP03	10.1007/978-3-540-39648-2_37	https://doi.org/10.1007/978-3-540-39648-2_37	URL#4119082
4119083	1	Entity Types Derived by Symbol-Generating Rules.	376-389	2003	Conference and Workshop Papers	conf/er/CabotOT03	https://dblp.org/rec/conf/er/CabotOT03	10.1007/978-3-540-39648-2_30	https://doi.org/10.1007/978-3-540-39648-2_30	URL#4119083
4119084	1	Querying Heterogeneous XML Sources through a Conceptual Schema.	186-199	2003	Conference and Workshop Papers	conf/er/CamilloHM03	https://dblp.org/rec/conf/er/CamilloHM03	10.1007/978-3-540-39648-2_17	https://doi.org/10.1007/978-3-540-39648-2_17	URL#4119084
4119085	1	Enterprise Information Integration ? XML to the Rescue!	14	2003	Conference and Workshop Papers	conf/er/Carey03	https://dblp.org/rec/conf/er/Carey03	10.1007/978-3-540-39648-2_3	https://doi.org/10.1007/978-3-540-39648-2_3	URL#4119085
4119087	1	Automatic Generation of XQuery View Definitions from ORA-SS Views.	158-171	2003	Conference and Workshop Papers	conf/er/ChenLL03	https://dblp.org/rec/conf/er/ChenLL03	10.1007/978-3-540-39648-2_15	https://doi.org/10.1007/978-3-540-39648-2_15	URL#4119087
4119089	1	Temporal Conceptual Modelling of Workflows.	59-76	2003	Conference and Workshop Papers	conf/er/CombiP03	https://dblp.org/rec/conf/er/CombiP03	10.1007/978-3-540-39648-2_8	https://doi.org/10.1007/978-3-540-39648-2_8	URL#4119089
4119091	1	Deriving Use Cases from Business Process Models.	131-143	2003	Conference and Workshop Papers	conf/er/Dietz03	https://dblp.org/rec/conf/er/Dietz03	10.1007/978-3-540-39648-2_13	https://doi.org/10.1007/978-3-540-39648-2_13	URL#4119091
4119092	1	Order-Sensitive View Maintenance of Materialized XQuery Views.	144-157	2003	Conference and Workshop Papers	conf/er/DimitrovaER03	https://dblp.org/rec/conf/er/DimitrovaER03	10.1007/978-3-540-39648-2_14	https://doi.org/10.1007/978-3-540-39648-2_14	URL#4119092
4119093	1	Operators and Classification for Data Mapping in Semantic Integration.	534-547	2003	Conference and Workshop Papers	conf/er/DobreHD03	https://dblp.org/rec/conf/er/DobreHD03	10.1007/978-3-540-39648-2_41	https://doi.org/10.1007/978-3-540-39648-2_41	URL#4119093
4119094	1	An OPM-Based Metamodel of System Development Process.	105-117	2003	Conference and Workshop Papers	conf/er/DoriR03	https://dblp.org/rec/conf/er/DoriR03	10.1007/978-3-540-39648-2_11	https://doi.org/10.1007/978-3-540-39648-2_11	URL#4119094
4119095	1	Developing Complex Systems with Object-Process Methodology Using OPCAT.	570-572	2003	Conference and Workshop Papers	conf/er/DoriRS03	https://dblp.org/rec/conf/er/DoriRS03	10.1007/978-3-540-39648-2_46	https://doi.org/10.1007/978-3-540-39648-2_46	URL#4119095
4119097	1	Goal-Based Business Modeling Oriented towards Late Requirements Generation.	277-290	2003	Conference and Workshop Papers	conf/er/EstradaMP03	https://dblp.org/rec/conf/er/EstradaMP03	10.1007/978-3-540-39648-2_23	https://doi.org/10.1007/978-3-540-39648-2_23	URL#4119097
4119099	1	Development of Web Applications from Web Enhanced Conceptual Schemas.	232-245	2003	Conference and Workshop Papers	conf/er/FonsPAP03	https://dblp.org/rec/conf/er/FonsPAP03	10.1007/978-3-540-39648-2_20	https://doi.org/10.1007/978-3-540-39648-2_20	URL#4119099
4119104	1	Requirement Engineering Meets Security - A Case Study on Modelling Secure Electronic Transactions by VISA and Mastercard.	263-276	2003	Conference and Workshop Papers	conf/er/GiorginiMM03	https://dblp.org/rec/conf/er/GiorginiMM03	10.1007/978-3-540-39648-2_22	https://doi.org/10.1007/978-3-540-39648-2_22	URL#4119104
4119106	1	Modeling Reactive Behavior in ORM.	567-569	2003	Conference and Workshop Papers	conf/er/HalpinW03	https://dblp.org/rec/conf/er/HalpinW03	10.1007/978-3-540-39648-2_45	https://doi.org/10.1007/978-3-540-39648-2_45	URL#4119106
4119107	1	Strategy for Database Application Evolution - The DB-MAIN Approach.	291-306	2003	Conference and Workshop Papers	conf/er/HickH03	https://dblp.org/rec/conf/er/HickH03	10.1007/978-3-540-39648-2_24	https://doi.org/10.1007/978-3-540-39648-2_24	URL#4119107
4119110	1	Automaton Meets Query Algebra - Towards a Unified Model for XQuery Evaluation over XML Data Streams.	172-185	2003	Conference and Workshop Papers	conf/er/JianSR03	https://dblp.org/rec/conf/er/JianSR03	10.1007/978-3-540-39648-2_16	https://doi.org/10.1007/978-3-540-39648-2_16	URL#4119110
4119113	1	Mining Typical Preferences of Collaborative User Groups.	419-432	2003	Conference and Workshop Papers	conf/er/KoH03	https://dblp.org/rec/conf/er/KoH03	10.1007/978-3-540-39648-2_33	https://doi.org/10.1007/978-3-540-39648-2_33	URL#4119113
4119115	1	A Declarative XML-RL Update Language.	506-519	2003	Conference and Workshop Papers	conf/er/LiuLW03	https://dblp.org/rec/conf/er/LiuLW03	10.1007/978-3-540-39648-2_39	https://doi.org/10.1007/978-3-540-39648-2_39	URL#4119115
4119118	1	Conceptual Data Models for Engineering Information Modeling and Formal Transformation of EER and EXPRESS-G.	573-575	2003	Conference and Workshop Papers	conf/er/MaLF03	https://dblp.org/rec/conf/er/MaLF03	10.1007/978-3-540-39648-2_47	https://doi.org/10.1007/978-3-540-39648-2_47	URL#4119118
4119119	1	Oh, so That Is What You Meant! The Interplay of Data Quality and Data Semantics.	3-13	2003	Conference and Workshop Papers	conf/er/Madnick03	https://dblp.org/rec/conf/er/Madnick03	10.1007/978-3-540-39648-2_2	https://doi.org/10.1007/978-3-540-39648-2_2	URL#4119119
4119121	1	A Comparison of Frameworks for Enterprise Architecture Modeling.	562-564	2003	Conference and Workshop Papers	conf/er/MartinR03	https://dblp.org/rec/conf/er/MartinR03	10.1007/978-3-540-39648-2_43	https://doi.org/10.1007/978-3-540-39648-2_43	URL#4119121
4119125	1	Semantic Web Application Modeling.	43862	2003	Conference and Workshop Papers	conf/er/Neuhold03	https://dblp.org/rec/conf/er/Neuhold03	10.1007/978-3-540-39648-2_1	https://doi.org/10.1007/978-3-540-39648-2_1	URL#4119125
4119126	1	Extending Conceptual Models for Web Based Applications.	216-231	2003	Conference and Workshop Papers	conf/er/OaksHES03	https://dblp.org/rec/conf/er/OaksHES03	10.1007/978-3-540-39648-2_19	https://doi.org/10.1007/978-3-540-39648-2_19	URL#4119126
4119127	1	Workflow Using AUML and Agents.	15-16	2003	Conference and Workshop Papers	conf/er/Odell03	https://dblp.org/rec/conf/er/Odell03	10.1007/978-3-540-39648-2_4	https://doi.org/10.1007/978-3-540-39648-2_4	URL#4119127
4119128	1	Integrity Constraints Definition in Object-Oriented Conceptual Modeling Languages.	349-362	2003	Conference and Workshop Papers	conf/er/Olive03	https://dblp.org/rec/conf/er/Olive03	10.1007/978-3-540-39648-2_28	https://doi.org/10.1007/978-3-540-39648-2_28	URL#4119128
4119130	1	A General Model for Online Analytical Processing of Complex Data.	321-334	2003	Conference and Workshop Papers	conf/er/Pei03	https://dblp.org/rec/conf/er/Pei03	10.1007/978-3-540-39648-2_26	https://doi.org/10.1007/978-3-540-39648-2_26	URL#4119130
4119134	1	Towards a Logical Model for Patterns.	77-90	2003	Conference and Workshop Papers	conf/er/RizziBCGHTVVV03	https://dblp.org/rec/conf/er/RizziBCGHTVVV03	10.1007/978-3-540-39648-2_9	https://doi.org/10.1007/978-3-540-39648-2_9	URL#4119134
4119135	1	AXIS - A XML Schema Integration System.	576-578	2003	Conference and Workshop Papers	conf/er/SakamuriMPCMB03	https://dblp.org/rec/conf/er/SakamuriMPCMB03	10.1007/978-3-540-39648-2_48	https://doi.org/10.1007/978-3-540-39648-2_48	URL#4119135
4119136	1	EITH - A Unifying Representation for Database Schema and Application Code in Enterprise Knowledge Extraction.	461-475	2003	Conference and Workshop Papers	conf/er/SchmalzHWT03	https://dblp.org/rec/conf/er/SchmalzHWT03	10.1007/978-3-540-39648-2_36	https://doi.org/10.1007/978-3-540-39648-2_36	URL#4119136
4119137	1	Designing Foundational Ontologies - The Object-Centered High-Level Reference Ontology OCHRE as a Case Study.	91-104	2003	Conference and Workshop Papers	conf/er/Schneider03	https://dblp.org/rec/conf/er/Schneider03	10.1007/978-3-540-39648-2_10	https://doi.org/10.1007/978-3-540-39648-2_10	URL#4119137
4119138	1	Episode-Based Conceptual Mining of Large Health Collections.	579-581	2003	Conference and Workshop Papers	conf/er/Semenova03	https://dblp.org/rec/conf/er/Semenova03	10.1007/978-3-540-39648-2_49	https://doi.org/10.1007/978-3-540-39648-2_49	URL#4119138
4119140	1	A Unified Approach for Software Policy Modeling - Incorporating Implementation into a Modeling Methodology.	118-130	2003	Conference and Workshop Papers	conf/er/ShimLW03	https://dblp.org/rec/conf/er/ShimLW03	10.1007/978-3-540-39648-2_12	https://doi.org/10.1007/978-3-540-39648-2_12	URL#4119140
4119141	1	DAISY, an RER Model Based Interface for RDB to ILP.	390-404	2003	Conference and Workshop Papers	conf/er/ShimazuMF03	https://dblp.org/rec/conf/er/ShimazuMF03	10.1007/978-3-540-39648-2_31	https://doi.org/10.1007/978-3-540-39648-2_31	URL#4119141
4119143	1	Context-Based Data Mining Using Ontologies.	405-418	2003	Conference and Workshop Papers	conf/er/SinghVL03	https://dblp.org/rec/conf/er/SinghVL03	10.1007/978-3-540-39648-2_32	https://doi.org/10.1007/978-3-540-39648-2_32	URL#4119143
4119145	1	On Analysing Query Ambiguity for Query Refinement - The Librarian Agent Approach.	490-505	2003	Conference and Workshop Papers	conf/er/Stojanovic03	https://dblp.org/rec/conf/er/Stojanovic03	10.1007/978-3-540-39648-2_38	https://doi.org/10.1007/978-3-540-39648-2_38	URL#4119145
4119146	1	QoM - Qualitative and Quantitative Schema Match Measure.	31-44	2003	Conference and Workshop Papers	conf/er/TansalarakC03	https://dblp.org/rec/conf/er/TansalarakC03	10.1007/978-3-540-39648-2_6	https://doi.org/10.1007/978-3-540-39648-2_6	URL#4119146
4119147	1	Conceptual Treatment of Multivalued Dependencies.	363-375	2003	Conference and Workshop Papers	conf/er/Thalheim03	https://dblp.org/rec/conf/er/Thalheim03	10.1007/978-3-540-39648-2_29	https://doi.org/10.1007/978-3-540-39648-2_29	URL#4119147
4119148	1	Querying and Integrating Ontologies Viewed as Conceptual Schemas.	548-561	2003	Conference and Workshop Papers	conf/er/TheodoratosD03	https://dblp.org/rec/conf/er/TheodoratosD03	10.1007/978-3-540-39648-2_42	https://doi.org/10.1007/978-3-540-39648-2_42	URL#4119148
4119150	1	A UML Based Approach for Modeling ETL Processes in Data Warehouses.	307-320	2003	Conference and Workshop Papers	conf/er/TrujilloL03	https://dblp.org/rec/conf/er/TrujilloL03	10.1007/978-3-540-39648-2_25	https://doi.org/10.1007/978-3-540-39648-2_25	URL#4119150
4119151	1	Taxonomy-Based Conceptual Modeling for Peer-to-Peer Networks.	446-460	2003	Conference and Workshop Papers	conf/er/TzitzikasMS03	https://dblp.org/rec/conf/er/TzitzikasMS03	10.1007/978-3-540-39648-2_35	https://doi.org/10.1007/978-3-540-39648-2_35	URL#4119151
