id_work	score_work	info_title_work	info_pages_work	info_year_work	info_type_work	info_key_work	info_url_work	info_doi_work	info_ee_work	url_work
2154899	1	Cognitive Mechanisms of Conceptual Modelling - How Do People Do It?	74-87	2013	Conference and Workshop Papers	conf/er/WilmontHBH13	https://dblp.org/rec/conf/er/WilmontHBH13	10.1007/978-3-642-41924-9_7	https://doi.org/10.1007/978-3-642-41924-9_7	URL#2154899
2154900	1	Cost-Informed Operational Process Support.	174-181	2013	Conference and Workshop Papers	conf/er/WynnRAOHARH13	https://dblp.org/rec/conf/er/WynnRAOHARH13	10.1007/978-3-642-41924-9_16	https://doi.org/10.1007/978-3-642-41924-9_16	URL#2154900
2154903	1	Optimising Conceptual Data Models through Profiling in Object Databases.	284-297	2013	Conference and Workshop Papers	conf/er/ZaschkeLGN13	https://dblp.org/rec/conf/er/ZaschkeLGN13	10.1007/978-3-642-41924-9_24	https://doi.org/10.1007/978-3-642-41924-9_24	URL#2154903
2154904	1	A Semantic Approach to Keyword Search over Relational Databases.	241-254	2013	Conference and Workshop Papers	conf/er/ZengBLL13	https://dblp.org/rec/conf/er/ZengBLL13	10.1007/978-3-642-41924-9_21	https://doi.org/10.1007/978-3-642-41924-9_21	URL#2154904
2420589	1	A Method for the Definition and Treatment of Conceptual Schema Quality Issues.	501-514	2012	Conference and Workshop Papers	conf/er/AguileraGO12	https://dblp.org/rec/conf/er/AguileraGO12	10.1007/978-3-642-34002-4_39	https://doi.org/10.1007/978-3-642-34002-4_39	URL#2420589
2420591	1	Schema Decryption for Large Extract-Transform-Load Systems.	116-125	2012	Conference and Workshop Papers	conf/er/AlbrechtN12	https://dblp.org/rec/conf/er/AlbrechtN12	10.1007/978-3-642-34002-4_9	https://doi.org/10.1007/978-3-642-34002-4_9	URL#2420591
2420593	1	A Preference-Aware Query Model for Data Web Services.	409-422	2012	Conference and Workshop Papers	conf/er/AmdouniBBHFG12	https://dblp.org/rec/conf/er/AmdouniBBHFG12	10.1007/978-3-642-34002-4_32	https://doi.org/10.1007/978-3-642-34002-4_32	URL#2420593
2420595	1	Using Domain Ontologies as Semantic Dimensions in Data Warehouses.	88-101	2012	Conference and Workshop Papers	conf/er/AnderlikNS12	https://dblp.org/rec/conf/er/AnderlikNS12	10.1007/978-3-642-34002-4_7	https://doi.org/10.1007/978-3-642-34002-4_7	URL#2420595
2420597	1	Deriving Variability Patterns in Software Product Lines by Ontological Considerations.	397-408	2012	Conference and Workshop Papers	conf/er/AsadiGWH12	https://dblp.org/rec/conf/er/AsadiGWH12	10.1007/978-3-642-34002-4_31	https://doi.org/10.1007/978-3-642-34002-4_31	URL#2420597
2420603	1	Conceptual Modeling for Systems Integration.	321-330	2012	Conference and Workshop Papers	conf/er/BollojuPT12	https://dblp.org/rec/conf/er/BollojuPT12	10.1007/978-3-642-34002-4_25	https://doi.org/10.1007/978-3-642-34002-4_25	URL#2420603
2420604	1	Mapping Semantic Widgets to Web-Based, Domain-Specific Collections.	204-213	2012	Conference and Workshop Papers	conf/er/BritellD12	https://dblp.org/rec/conf/er/BritellD12	10.1007/978-3-642-34002-4_16	https://doi.org/10.1007/978-3-642-34002-4_16	URL#2420604
2420610	1	The MOSKitt4ME Approach - Providing Process Support in a Method Engineering Context.	228-241	2012	Conference and Workshop Papers	conf/er/CerveraATP12	https://dblp.org/rec/conf/er/CerveraATP12	10.1007/978-3-642-34002-4_18	https://doi.org/10.1007/978-3-642-34002-4_18	URL#2420610
2420613	1	A NFR-Based Framework for User-Centered Adaptation.	439-448	2012	Conference and Workshop Papers	conf/er/DalpiazSVGP12	https://dblp.org/rec/conf/er/DalpiazSVGP12	10.1007/978-3-642-34002-4_34	https://doi.org/10.1007/978-3-642-34002-4_34	URL#2420613
2420616	1	Cross-Language Hybrid Keyword and Semantic Search.	190-203	2012	Conference and Workshop Papers	conf/er/EmbleyLLPSZ12	https://dblp.org/rec/conf/er/EmbleyLLPSZ12	10.1007/978-3-642-34002-4_15	https://doi.org/10.1007/978-3-642-34002-4_15	URL#2420616
2420617	1	Synthesizing Object Life Cycles from Business Process Models.	307-320	2012	Conference and Workshop Papers	conf/er/EshuisG12	https://dblp.org/rec/conf/er/EshuisG12	10.1007/978-3-642-34002-4_24	https://doi.org/10.1007/978-3-642-34002-4_24	URL#2420617
2420618	1	EERMM - A Metamodel for the Enhanced Entity-Relationship Model.	515-524	2012	Conference and Workshop Papers	conf/er/FidalgoSECP12	https://dblp.org/rec/conf/er/FidalgoSECP12	10.1007/978-3-642-34002-4_40	https://doi.org/10.1007/978-3-642-34002-4_40	URL#2420618
2420625	1	Evaluation Measures for Similarity Search Results in Process Model Repositories.	214-227	2012	Conference and Workshop Papers	conf/er/GuentertKW12	https://dblp.org/rec/conf/er/GuentertKW12	10.1007/978-3-642-34002-4_17	https://doi.org/10.1007/978-3-642-34002-4_17	URL#2420625
2420626	1	Towards Discovering Conceptual Models behind Web Sites.	166-175	2012	Conference and Workshop Papers	conf/er/HernandezRRC12	https://dblp.org/rec/conf/er/HernandezRRC12	10.1007/978-3-642-34002-4_13	https://doi.org/10.1007/978-3-642-34002-4_13	URL#2420626
2420628	1	Understanding Understandability of Conceptual Models - What Are We Actually Talking about?	64-77	2012	Conference and Workshop Papers	conf/er/HouyFL12	https://dblp.org/rec/conf/er/HouyFL12	10.1007/978-3-642-34002-4_5	https://doi.org/10.1007/978-3-642-34002-4_5	URL#2420628
2420630	1	User Feedback Based Query Refinement by Exploiting Skyline Operator.	423-438	2012	Conference and Workshop Papers	conf/er/IslamLZ12	https://dblp.org/rec/conf/er/IslamLZ12	10.1007/978-3-642-34002-4_33	https://doi.org/10.1007/978-3-642-34002-4_33	URL#2420630
2420634	1	Ontology Evolution - Assisting Query Migration.	331-344	2012	Conference and Workshop Papers	conf/er/KondylakisP12	https://dblp.org/rec/conf/er/KondylakisP12	10.1007/978-3-642-34002-4_26	https://doi.org/10.1007/978-3-642-34002-4_26	URL#2420634
2420636	1	Contracts + Goals = Roles?	252-266	2012	Conference and Workshop Papers	conf/er/LeG12	https://dblp.org/rec/conf/er/LeG12	10.1007/978-3-642-34002-4_20	https://doi.org/10.1007/978-3-642-34002-4_20	URL#2420636
2420637	1	A Distance-Based Spelling Suggestion Method for XML Keyword Search.	176-189	2012	Conference and Workshop Papers	conf/er/LiWWL12	https://dblp.org/rec/conf/er/LiWWL12	10.1007/978-3-642-34002-4_14	https://doi.org/10.1007/978-3-642-34002-4_14	URL#2420637
2420638	1	Ontology of Dynamic Entities.	345-358	2012	Conference and Workshop Papers	conf/er/LimonadLLHV12	https://dblp.org/rec/conf/er/LimonadLLHV12	10.1007/978-3-642-34002-4_27	https://doi.org/10.1007/978-3-642-34002-4_27	URL#2420638
2420640	1	Specialization in i* Strategic Rationale Diagrams.	267-281	2012	Conference and Workshop Papers	conf/er/LopezFM12	https://dblp.org/rec/conf/er/LopezFM12	10.1007/978-3-642-34002-4_21	https://doi.org/10.1007/978-3-642-34002-4_21	URL#2420640
2420641	1	Extending Conceptual Data Model for Dynamic Environment.	242-251	2012	Conference and Workshop Papers	conf/er/LumineauLGP12	https://dblp.org/rec/conf/er/LumineauLGP12	10.1007/978-3-642-34002-4_19	https://doi.org/10.1007/978-3-642-34002-4_19	URL#2420641
2420643	1	Conceptualizing and Specifying Key Performance Indicators in Business Strategy Models.	282-291	2012	Conference and Workshop Papers	conf/er/MateTM12	https://dblp.org/rec/conf/er/MateTM12	10.1007/978-3-642-34002-4_22	https://doi.org/10.1007/978-3-642-34002-4_22	URL#2420643
2420649	1	Fast Group Recommendations by Applying User Clustering.	126-140	2012	Conference and Workshop Papers	conf/er/NtoutsiSNK12	https://dblp.org/rec/conf/er/NtoutsiSNK12	10.1007/978-3-642-34002-4_10	https://doi.org/10.1007/978-3-642-34002-4_10	URL#2420649
2420657	1	An Integrated Conceptual Model to Incorporate Information Tasks in Workflow Models.	487-500	2012	Conference and Workshop Papers	conf/er/PuraoMSJR12	https://dblp.org/rec/conf/er/PuraoMSJR12	10.1007/978-3-642-34002-4_38	https://doi.org/10.1007/978-3-642-34002-4_38	URL#2420657
2420662	1	Non-binary Evaluation for Schema Matching.	477-486	2012	Conference and Workshop Papers	conf/er/SagiG12	https://dblp.org/rec/conf/er/SagiG12	10.1007/978-3-642-34002-4_37	https://doi.org/10.1007/978-3-642-34002-4_37	URL#2420662
2420664	1	Sliced Column-Store (SCS) - Ontological Foundations and Practical Implications.	102-115	2012	Conference and Workshop Papers	conf/er/SekhavatP12	https://dblp.org/rec/conf/er/SekhavatP12	10.1007/978-3-642-34002-4_8	https://doi.org/10.1007/978-3-642-34002-4_8	URL#2420664
2420666	1	Capturing Variability of Law with Nómos 2.	383-396	2012	Conference and Workshop Papers	conf/er/SienaJISPM12	https://dblp.org/rec/conf/er/SienaJISPM12	10.1007/978-3-642-34002-4_30	https://doi.org/10.1007/978-3-642-34002-4_30	URL#2420666
2420669	1	A Supervised Method for Lexical Annotation of Schema Labels Based on Wikipedia.	359-368	2012	Conference and Workshop Papers	conf/er/SorrentinoBP12	https://dblp.org/rec/conf/er/SorrentinoBP12	10.1007/978-3-642-34002-4_28	https://doi.org/10.1007/978-3-642-34002-4_28	URL#2420669
2420671	1	Rules from Cognition for Conceptual Modelling.	78-87	2012	Conference and Workshop Papers	conf/er/StarkE12	https://dblp.org/rec/conf/er/StarkE12	10.1007/978-3-642-34002-4_6	https://doi.org/10.1007/978-3-642-34002-4_6	URL#2420671
2420675	1	Understanding Constraint Expressions in Large Conceptual Schemas by Automatic Filtering.	50-63	2012	Conference and Workshop Papers	conf/er/VillegasOS12	https://dblp.org/rec/conf/er/VillegasOS12	10.1007/978-3-642-34002-4_4	https://doi.org/10.1007/978-3-642-34002-4_4	URL#2420675
2420677	1	A Linear Algebra Technique for (de)Centralized Processing of SPARQL Queries.	463-476	2012	Conference and Workshop Papers	conf/er/Virgilio12	https://dblp.org/rec/conf/er/Virgilio12	10.1007/978-3-642-34002-4_36	https://doi.org/10.1007/978-3-642-34002-4_36	URL#2420677
2420680	1	Concept-Based Web Search.	449-462	2012	Conference and Workshop Papers	conf/er/WangLWZ12	https://dblp.org/rec/conf/er/WangLWZ12	10.1007/978-3-642-34002-4_35	https://doi.org/10.1007/978-3-642-34002-4_35	URL#2420680
2420681	1	Understanding Tables on the Web.	141-155	2012	Conference and Workshop Papers	conf/er/WangWWZ12	https://dblp.org/rec/conf/er/WangWWZ12	10.1007/978-3-642-34002-4_11	https://doi.org/10.1007/978-3-642-34002-4_11	URL#2420681
2420684	1	Bridging the Gaps towards Advanced Data Discovery over Semi-structured Data.	156-165	2012	Conference and Workshop Papers	conf/er/YogevR12	https://dblp.org/rec/conf/er/YogevR12	10.1007/978-3-642-34002-4_12	https://doi.org/10.1007/978-3-642-34002-4_12	URL#2420684
2420685	1	Optimising Schema Evolution Operation Sequences in Object Databases for Data Evolution.	369-382	2012	Conference and Workshop Papers	conf/er/ZaschkeLN12	https://dblp.org/rec/conf/er/ZaschkeLN12	10.1007/978-3-642-34002-4_29	https://doi.org/10.1007/978-3-642-34002-4_29	URL#2420685
2670330	1	Merging Relational Views - A Minimization Approach.	379-392	2011	Conference and Workshop Papers	conf/er/0002Q11	https://dblp.org/rec/conf/er/0002Q11	10.1007/978-3-642-24606-7_28	https://doi.org/10.1007/978-3-642-24606-7_28	URL#2670330
2670333	1	Automatically Mapping and Integrating Multiple Data Entry Forms into a Database.	261-274	2011	Conference and Workshop Papers	conf/er/AnKSH11	https://dblp.org/rec/conf/er/AnKSH11	10.1007/978-3-642-24606-7_20	https://doi.org/10.1007/978-3-642-24606-7_20	URL#2670333
2670334	1	Design by Selection - A Reuse-Based Approach for Business Process Modeling.	332-345	2011	Conference and Workshop Papers	conf/er/AwadSKW11	https://dblp.org/rec/conf/er/AwadSKW11	10.1007/978-3-642-24606-7_25	https://doi.org/10.1007/978-3-642-24606-7_25	URL#2670334
2670336	1	Composite Indicators for Business Intelligence.	448-458	2011	Conference and Workshop Papers	conf/er/BaroneJAM11	https://dblp.org/rec/conf/er/BaroneJAM11	10.1007/978-3-642-24606-7_35	https://doi.org/10.1007/978-3-642-24606-7_35	URL#2670336
2670339	1	A Hidden Markov Model Approach to Keyword-Based Search over Relational Databases.	411-420	2011	Conference and Workshop Papers	conf/er/BergamaschiGRV11	https://dblp.org/rec/conf/er/BergamaschiGRV11	10.1007/978-3-642-24606-7_31	https://doi.org/10.1007/978-3-642-24606-7_31	URL#2670339
2670348	1	Querying Conceptual Schemata with Expressive Equality Constraints.	161-174	2011	Conference and Workshop Papers	conf/er/CaliGP11	https://dblp.org/rec/conf/er/CaliGP11	10.1007/978-3-642-24606-7_13	https://doi.org/10.1007/978-3-642-24606-7_13	URL#2670348
2670349	1	A Semantic Oriented Method for Conceptual Data Modeling in OntoUML Based on Linguistic Concepts.	486-494	2011	Conference and Workshop Papers	conf/er/CastroBG11	https://dblp.org/rec/conf/er/CastroBG11	10.1007/978-3-642-24606-7_39	https://doi.org/10.1007/978-3-642-24606-7_39	URL#2670349
2670351	1	Sociotechnical Trust - An Architectural Approach.	104-117	2011	Conference and Workshop Papers	conf/er/ChopraPG11	https://dblp.org/rec/conf/er/ChopraPG11	10.1007/978-3-642-24606-7_9	https://doi.org/10.1007/978-3-642-24606-7_9	URL#2670351
2670352	1	Modeling the Propagation of User Preferences.	304-317	2011	Conference and Workshop Papers	conf/er/CiacciaT11	https://dblp.org/rec/conf/er/CiacciaT11	10.1007/978-3-642-24606-7_23	https://doi.org/10.1007/978-3-642-24606-7_23	URL#2670352
2670354	1	Formal Semantics and Ontological Analysis for Understanding Subsetting, Specialization and Redefinition of Associations in UML.	189-203	2011	Conference and Workshop Papers	conf/er/CostalGG11	https://dblp.org/rec/conf/er/CostalGG11	10.1007/978-3-642-24606-7_15	https://doi.org/10.1007/978-3-642-24606-7_15	URL#2670354
2670360	1	Multilingual Ontologies for Cross-Language Information Extraction and Semantic Search.	147-160	2011	Conference and Workshop Papers	conf/er/EmbleyLLT11	https://dblp.org/rec/conf/er/EmbleyLLT11	10.1007/978-3-642-24606-7_12	https://doi.org/10.1007/978-3-642-24606-7_12	URL#2670360
2670361	1	A Precious Class of Cardinality Constraints for Flexible XML Data Processing.	175-188	2011	Conference and Workshop Papers	conf/er/FerrarottiHL11	https://dblp.org/rec/conf/er/FerrarottiHL11	10.1007/978-3-642-24606-7_14	https://doi.org/10.1007/978-3-642-24606-7_14	URL#2670361
2670362	1	The Impact of Perceived Cognitive Effectiveness on Perceived Usefulness of Visual Conceptual Modeling Languages.	78-91	2011	Conference and Workshop Papers	conf/er/FiglD11	https://dblp.org/rec/conf/er/FiglD11	10.1007/978-3-642-24606-7_7	https://doi.org/10.1007/978-3-642-24606-7_7	URL#2670362
2670370	1	Establishing Regulatory Compliance for Software Requirements.	47-61	2011	Conference and Workshop Papers	conf/er/IngolfoSM11	https://dblp.org/rec/conf/er/IngolfoSM11	10.1007/978-3-642-24606-7_5	https://doi.org/10.1007/978-3-642-24606-7_5	URL#2670370
2670371	1	Strategic Models for Business Intelligence.	429-439	2011	Conference and Workshop Papers	conf/er/JiangBAM11	https://dblp.org/rec/conf/er/JiangBAM11	10.1007/978-3-642-24606-7_33	https://doi.org/10.1007/978-3-642-24606-7_33	URL#2670371
2670374	1	Visual Change Tracking for Business Process Models.	504-513	2011	Conference and Workshop Papers	conf/er/KabicherKR11	https://dblp.org/rec/conf/er/KabicherKR11	10.1007/978-3-642-24606-7_41	https://doi.org/10.1007/978-3-642-24606-7_41	URL#2670374
2670378	1	Ontology Evolution in Data Integration - Query Rewriting to the Rescue.	393-401	2011	Conference and Workshop Papers	conf/er/KondylakisP11	https://dblp.org/rec/conf/er/KondylakisP11	10.1007/978-3-642-24606-7_29	https://doi.org/10.1007/978-3-642-24606-7_29	URL#2670378
2670380	1	Content-Based Validation of Business Process Modifications.	495-503	2011	Conference and Workshop Papers	conf/er/LincolnG11	https://dblp.org/rec/conf/er/LincolnG11	10.1007/978-3-642-24606-7_40	https://doi.org/10.1007/978-3-642-24606-7_40	URL#2670380
2670382	1	Making Explicit Some Implicit i* Language Decisions.	62-77	2011	Conference and Workshop Papers	conf/er/LopezFM11	https://dblp.org/rec/conf/er/LopezFM11	10.1007/978-3-642-24606-7_6	https://doi.org/10.1007/978-3-642-24606-7_6	URL#2670382
2670385	1	Effects of External Conceptual Models and Verbal Explanations on Shared Understanding in Small Groups.	92-103	2011	Conference and Workshop Papers	conf/er/MaassSK11	https://dblp.org/rec/conf/er/MaassSK11	10.1007/978-3-642-24606-7_8	https://doi.org/10.1007/978-3-642-24606-7_8	URL#2670385
2670388	1	Impact of MDE Approaches on the Maintainability of Web Applications - An Experimental Evaluation.	233-246	2011	Conference and Workshop Papers	conf/er/MartinezCMAL11	https://dblp.org/rec/conf/er/MartinezCMAL11	10.1007/978-3-642-24606-7_18	https://doi.org/10.1007/978-3-642-24606-7_18	URL#2670388
2670390	1	Incorporating Traceability in Conceptual Models for Data Warehouses by Using MDA.	459-466	2011	Conference and Workshop Papers	conf/er/MateT11	https://dblp.org/rec/conf/er/MateT11	10.1007/978-3-642-24606-7_36	https://doi.org/10.1007/978-3-642-24606-7_36	URL#2670390
2670391	1	A Modularization Proposal for Goal-Oriented Analysis of Data Warehouses Using I-Star.	421-428	2011	Conference and Workshop Papers	conf/er/MateTF11	https://dblp.org/rec/conf/er/MateTF11	10.1007/978-3-642-24606-7_32	https://doi.org/10.1007/978-3-642-24606-7_32	URL#2670391
2670397	1	Developing RFID Database Models for Analysing Moving Tags in Supply Chain Management.	204-218	2011	Conference and Workshop Papers	conf/er/Ng11	https://dblp.org/rec/conf/er/Ng11	10.1007/978-3-642-24606-7_16	https://doi.org/10.1007/978-3-642-24606-7_16	URL#2670397
2670398	1	An Empirical Analysis of Human Performance and Error in Process Model Development.	514-523	2011	Conference and Workshop Papers	conf/er/NielenKMKS11	https://dblp.org/rec/conf/er/NielenKMKS11	10.1007/978-3-642-24606-7_42	https://doi.org/10.1007/978-3-642-24606-7_42	URL#2670398
2670401	1	Using UML Profiles for Sector-Specific Tailoring of Safety Evidence Information.	362-378	2011	Conference and Workshop Papers	conf/er/Panesar-WalawegeSB11	https://dblp.org/rec/conf/er/Panesar-WalawegeSB11	10.1007/978-3-642-24606-7_27	https://doi.org/10.1007/978-3-642-24606-7_27	URL#2670401
2670403	1	Evolving Requirements in Socio-Technical Systems - Concepts and Practice.	440-447	2011	Conference and Workshop Papers	conf/er/PeriniQSSS11	https://dblp.org/rec/conf/er/PeriniQSSS11	10.1007/978-3-642-24606-7_34	https://doi.org/10.1007/978-3-642-24606-7_34	URL#2670403
2670404	1	Lightweight Verification of Executable Models.	467-475	2011	Conference and Workshop Papers	conf/er/PlanasCG11	https://dblp.org/rec/conf/er/PlanasCG11	10.1007/978-3-642-24606-7_37	https://doi.org/10.1007/978-3-642-24606-7_37	URL#2670404
2670405	1	Context Schema Evolution in Context-Aware Data Management.	290-303	2011	Conference and Workshop Papers	conf/er/QuintarelliRT11	https://dblp.org/rec/conf/er/QuintarelliRT11	10.1007/978-3-642-24606-7_22	https://doi.org/10.1007/978-3-642-24606-7_22	URL#2670405
2670406	1	From Pattern-Based User Interfaces to Conceptual Schemas and Back.	247-260	2011	Conference and Workshop Papers	conf/er/RamdoyalC11	https://dblp.org/rec/conf/er/RamdoyalC11	10.1007/978-3-642-24606-7_19	https://doi.org/10.1007/978-3-642-24606-7_19	URL#2670406
2670408	1	External Variability of Software - Classification and Ontological Foundations.	275-289	2011	Conference and Workshop Papers	conf/er/Reinhartz-BergerSW11	https://dblp.org/rec/conf/er/Reinhartz-BergerSW11	10.1007/978-3-642-24606-7_21	https://doi.org/10.1007/978-3-642-24606-7_21	URL#2670408
2670411	1	Generating SPARQL Executable Mappings to Integrate Ontologies.	118-131	2011	Conference and Workshop Papers	conf/er/RiveroHRC11	https://dblp.org/rec/conf/er/RiveroHRC11	10.1007/978-3-642-24606-7_10	https://doi.org/10.1007/978-3-642-24606-7_10	URL#2670411
2670414	1	Enterprise Monitoring Ontology.	132-146	2011	Conference and Workshop Papers	conf/er/SilvaW11	https://dblp.org/rec/conf/er/SilvaW11	10.1007/978-3-642-24606-7_11	https://doi.org/10.1007/978-3-642-24606-7_11	URL#2670414
2670417	1	System Identification for Adaptive Software Systems - A Requirements Engineering Perspective.	346-361	2011	Conference and Workshop Papers	conf/er/SouzaLM11	https://dblp.org/rec/conf/er/SouzaLM11	10.1007/978-3-642-24606-7_26	https://doi.org/10.1007/978-3-642-24606-7_26	URL#2670417
2670419	1	CSRML - A Goal-Oriented Approach to Model Requirements for Collaborative Systems.	33-46	2011	Conference and Workshop Papers	conf/er/TeruelNLMG11	https://dblp.org/rec/conf/er/TeruelNLMG11	10.1007/978-3-642-24606-7_4	https://doi.org/10.1007/978-3-642-24606-7_4	URL#2670419
2670420	1	Towards a Theory of Refinement for Data Migration.	318-331	2011	Conference and Workshop Papers	conf/er/ThalheimW11	https://dblp.org/rec/conf/er/ThalheimW11	10.1007/978-3-642-24606-7_24	https://doi.org/10.1007/978-3-642-24606-7_24	URL#2670420
2670421	1	Semi-automatic Conceptual Data Modeling Using Entity and Relationship Instance Repositories.	219-232	2011	Conference and Workshop Papers	conf/er/ThonggoomSA11	https://dblp.org/rec/conf/er/ThonggoomSA11	10.1007/978-3-642-24606-7_17	https://doi.org/10.1007/978-3-642-24606-7_17	URL#2670421
2670427	1	Object-Oriented XML Keyword Search.	402-410	2011	Conference and Workshop Papers	conf/er/WuB11	https://dblp.org/rec/conf/er/WuB11	10.1007/978-3-642-24606-7_30	https://doi.org/10.1007/978-3-642-24606-7_30	URL#2670427
2902643	1	Full Satisfiability of UML Class Diagrams.	317-331	2010	Conference and Workshop Papers	conf/er/ArtaleCI10	https://dblp.org/rec/conf/er/ArtaleCI10	10.1007/978-3-642-16373-9_23	https://doi.org/10.1007/978-3-642-16373-9_23	URL#2902643
2902644	1	Complexity of Reasoning over Temporal Data Models.	174-187	2010	Conference and Workshop Papers	conf/er/ArtaleKRZ10	https://dblp.org/rec/conf/er/ArtaleKRZ10	10.1007/978-3-642-16373-9_13	https://doi.org/10.1007/978-3-642-16373-9_13	URL#2902644
2902646	1	Situation Prediction Nets - Playing the Token Game for Ontology-Driven Situation Awareness.	202-218	2010	Conference and Workshop Papers	conf/er/BaumgartnerGMRS10	https://dblp.org/rec/conf/er/BaumgartnerGMRS10	10.1007/978-3-642-16373-9_15	https://doi.org/10.1007/978-3-642-16373-9_15	URL#2902646
2902653	1	Specifying Aggregation Functions in Multidimensional Models with OCL.	419-432	2010	Conference and Workshop Papers	conf/er/CabotMPT10	https://dblp.org/rec/conf/er/CabotMPT10	10.1007/978-3-642-16373-9_30	https://doi.org/10.1007/978-3-642-16373-9_30	URL#2902653
2902654	1	Query Answering under Expressive Entity-Relationship Schemata.	347-361	2010	Conference and Workshop Papers	conf/er/CaliGP10	https://dblp.org/rec/conf/er/CaliGP10	10.1007/978-3-642-16373-9_25	https://doi.org/10.1007/978-3-642-16373-9_25	URL#2902654
2902656	1	A Conceptual Approach to Database Applications Evolution.	132-145	2010	Conference and Workshop Papers	conf/er/CleveBH10	https://dblp.org/rec/conf/er/CleveBH10	10.1007/978-3-642-16373-9_10	https://doi.org/10.1007/978-3-642-16373-9_10	URL#2902656
2902660	1	Adaptation in Open Systems - Giving Interaction Its Rightful Place.	31-45	2010	Conference and Workshop Papers	conf/er/DalpiazCGM10	https://dblp.org/rec/conf/er/DalpiazCGM10	10.1007/978-3-642-16373-9_3	https://doi.org/10.1007/978-3-642-16373-9_3	URL#2902660
2902661	1	Measuring the Quality of an Integrated Schema.	261-273	2010	Conference and Workshop Papers	conf/er/DuchateauB10	https://dblp.org/rec/conf/er/DuchateauB10	10.1007/978-3-642-16373-9_19	https://doi.org/10.1007/978-3-642-16373-9_19	URL#2902661
2902663	1	Reasoning with Optional and Preferred Requirements.	118-131	2010	Conference and Workshop Papers	conf/er/ErnstMBJ10	https://dblp.org/rec/conf/er/ErnstMBJ10	10.1007/978-3-642-16373-9_9	https://doi.org/10.1007/978-3-642-16373-9_9	URL#2902663
2902665	1	Contextual Factors in Database Integration - A Delphi Study.	274-287	2010	Conference and Workshop Papers	conf/er/Evermann10	https://dblp.org/rec/conf/er/Evermann10	10.1007/978-3-642-16373-9_20	https://doi.org/10.1007/978-3-642-16373-9_20	URL#2902665
2902671	1	Using Preaggregation to Speed Up Scaling Operations on Massive Spatio-temporal Data.	188-201	2010	Conference and Workshop Papers	conf/er/GutierrezB10	https://dblp.org/rec/conf/er/GutierrezB10	10.1007/978-3-642-16373-9_14	https://doi.org/10.1007/978-3-642-16373-9_14	URL#2902671
2902672	1	Granularity in Conceptual Modelling - Application to Metamodels.	219-232	2010	Conference and Workshop Papers	conf/er/Henderson-SellersG10	https://dblp.org/rec/conf/er/Henderson-SellersG10	10.1007/978-3-642-16373-9_16	https://doi.org/10.1007/978-3-642-16373-9_16	URL#2902672
2902676	1	Finding Solutions in Goal Models - An Interactive Backward Reasoning Approach.	59-75	2010	Conference and Workshop Papers	conf/er/HorkoffY10	https://dblp.org/rec/conf/er/HorkoffY10	10.1007/978-3-642-16373-9_5	https://doi.org/10.1007/978-3-642-16373-9_5	URL#2902676
2902677	1	Building Dynamic Models of Service Compositions with Simulation of Provision Resources.	288-301	2010	Conference and Workshop Papers	conf/er/IvanovicTCD10	https://dblp.org/rec/conf/er/IvanovicTCD10	10.1007/978-3-642-16373-9_21	https://doi.org/10.1007/978-3-642-16373-9_21	URL#2902677
2902679	1	Information Use in Solving a Well-Structured IS Problem - The Roles of IS and Application Domain Knowledge.	46-58	2010	Conference and Workshop Papers	conf/er/KhatriV10	https://dblp.org/rec/conf/er/KhatriV10	10.1007/978-3-642-16373-9_4	https://doi.org/10.1007/978-3-642-16373-9_4	URL#2902679
2902681	1	On Enabling Data-Aware Compliance Checking of Business Process Models.	332-346	2010	Conference and Workshop Papers	conf/er/KnupleschLRPD10	https://dblp.org/rec/conf/er/KnupleschLRPD10	10.1007/978-3-642-16373-9_24	https://doi.org/10.1007/978-3-642-16373-9_24	URL#2902681
2902683	1	Decision-Making Ontology for Information System Engineering.	104-117	2010	Conference and Workshop Papers	conf/er/KornyshovaD10	https://dblp.org/rec/conf/er/KornyshovaD10	10.1007/978-3-642-16373-9_8	https://doi.org/10.1007/978-3-642-16373-9_8	URL#2902683
2902684	1	A SchemaGuide for Accelerating the View Adaptation Process.	160-173	2010	Conference and Workshop Papers	conf/er/LiuRB10	https://dblp.org/rec/conf/er/LiuRB10	10.1007/978-3-642-16373-9_12	https://doi.org/10.1007/978-3-642-16373-9_12	URL#2902684
